	summarized	lineages	abundances	resid	coverage
SRR25657356.tsv	[('XBB.1.9* [Omicron (XBB.1.9.X)]', 0.43843005360312154), ('XBB.1.16* [Omicron (XBB.1.16.X)]', 0.23009353651121797), ('XBB.2.3* [Omicron (XBB.2.3.X)]', 0.16684021516558528), ('XBB.1.5* [Omicron (XBB.1.5.X)]', 0.14730604771026867), ('XBB* (XBB.X)', 0.016406515411768737), ('Other', 0.0005888152399938852), ('Omicron', 0.00014063396186046777), ('CH.1.1* [Omicron (CH.1.1.X)]', 4.229529522259822e-05), ('Alpha', 2.393541517793103e-05), ('Gamma', 1.4150547540230813e-05)]	EG.5.1.3 EG.5.1.4 EG.5 XBB.1.16.13 XBB.1.16.12 GJ.1.2 XBB.1.5.49 XBB.1.16.6 JA.1 GJ.1 HT.2 XBB.1.5.59 EG.5.1 XBB.1.16.21 XBB.1.22.2 XBB.1.5.100 XBB.2.3.12 XBB.1.16.10 XBB.1.5.95 GS.1 XBB.1.5.55 XBB.2.3.8 XBB.1.5.67 XBB.2.3.9 XBB.1.16.19 XBB.1.5.10 FL.1.2 FL.1 HQ.1 FU.2 XBB.1.44.1 XBB.1.5.19 EG.6 XBB.1.16.5 FY.6 XBB.1.5.76 XBB.1.16.15 FU.1 EG.5.2.3 XBB.1.16.8 FL.23.1 XBB.1.5.9 XBB.1.5.83 FL.19.1 XBB.1.5.81 XBB.1.5.82 XBB.1.5.78 EG.5.2.2 HJ.1 HF.1 FU.5 GU.1 XBW GJ.1.1 EG.5.1.6 XBB.1.16.7 XBB.1.5.41 HU.2 HN.1 XBB.1.5.32 XBB.1.5.50 XBB.1.16.16 XBB.2.3.10 GB.2 XBB.1.45.1 GY.1 FL.1.3 EG.9.1 XBB.1.16.14 FH.1 HA.2 XBB.1.5.72 GW.2 XBB.1.5.27 FL.18.1 GV.1 FP.2.1.2 FT.2 GJ.4 GW.1 FE.1.2 XBB.1.3 GC.1 HL.1 FY.1.2 XBB.1.16.9 HP.1.1 XBB.1.5.2 XBB.1.5.18 XBB.1.5.90 XBB.1.20 XBB.6.1 FL.4.2 XBB.8.1 GZ.1 XBB.1.5.54 FU.3.1 HR.1 FL.21.1 XAW XBV GN.3 EG.4.4 FP.1 FL.20 XBB.2.3.6 XBB.1.5.44 FD.1.1 FY.2.1 EU.1.1.1 XBB.1.5.74 GN.5 FT.1 XBB.1.15.1 XBB.1.9.6 FL.17 XBB.1.31.1 FL.5.1 XBB.1.5.64 EK.2 B.1.641 XBB.1.16.18 BA.2.9.1 HK.2 XBB.1.5.26 XBB.1.37.1 XBB.1.5.96 BA.2.86 XBB.2.3.1 FY.4 XBB.1.5.1 FL.1.5 GH.1 FL.9 HT.1 XBB.1.5.101 GJ.2 FL.28 HD.1 XBB.1.5.80 FL.3.3 HZ.1 XBB.1.5.89 GY.8 HH.2 HK.1 XCF XBB.1.5.84 GJ.1.2.1 XBB.1.5.5 EG.5.2.1 XBB.1.24.1 FL.4.7 EG.5.2 EK.1 FL.2.3.1 XBB.2.3.5 FZ.1.1 XBB.1.22.3 GK.1.1 B.1.619.1 XBB.1.16.20 FY.3.1 EU.1 XBB.1.33 HH.1.1 XAY.1.2 FK.1.3.2 HB.1 XBB.1.5.39 FL.15 XBB.1.16.4 FL.1.1.1 HW.1.1 XBB.1.5.8 Q.2 XBL.3.1 GN.2 GD.3 EG.8 N.10 B.1.632 FL.3.4 B.1.640.2 GK.1.3 BF.5.3 XBB.1.5.34 XBB.1.5.25 XBB.1.5.85 B.1.575.2 XBB.1.5.93 XBJ.1.1 FK.1.3.1 EG.6.1 P.1.12.1 FW.3 XBB.1.5.60 B.1.243.2 FL.13.3.1 GN.1 GN.1.1 FL.1.7 GY.4 XBB.3.2 XBB.1.5.77 FL.13.3 FL.20.1 B.1.616	0.16965054 0.14223765 0.10449573 0.08267610 0.08018006 0.07373744 0.07004441 0.04676990 0.04540883 0.04390325 0.03394110 0.02326524 0.01852822 0.01644621 0.01414626 0.01271424 0.00134582 0.00119535 0.00075087 0.00069564 0.00054842 0.00053547 0.00051256 0.00047384 0.00047205 0.00045237 0.00041277 0.00041277 0.00030479 0.00030051 0.00029965 0.00029149 0.00028198 0.00026560 0.00024867 0.00024652 0.00022504 0.00022460 0.00021721 0.00021402 0.00020721 0.00019026 0.00018665 0.00017423 0.00015879 0.00015583 0.00015575 0.00015466 0.00015449 0.00015270 0.00015246 0.00014559 0.00014449 0.00014434 0.00014398 0.00013948 0.00013853 0.00013341 0.00013277 0.00013006 0.00012933 0.00012596 0.00012426 0.00012397 0.00012180 0.00012091 0.00011473 0.00011305 0.00011194 0.00010968 0.00010585 0.00010467 0.00010295 0.00010192 0.00009856 0.00009686 0.00009422 0.00009203 0.00009153 0.00009132 0.00009108 0.00009041 0.00009017 0.00008976 0.00008861 0.00008682 0.00008095 0.00008067 0.00007838 0.00007823 0.00007577 0.00007539 0.00007514 0.00007497 0.00007285 0.00007153 0.00007008 0.00006944 0.00006932 0.00006790 0.00006757 0.00006754 0.00006726 0.00006603 0.00006576 0.00006537 0.00006532 0.00006445 0.00006432 0.00006355 0.00006230 0.00006141 0.00005989 0.00005964 0.00005750 0.00005749 0.00005657 0.00005623 0.00005614 0.00005538 0.00005486 0.00005448 0.00005440 0.00005350 0.00005286 0.00005282 0.00005210 0.00005206 0.00005180 0.00005105 0.00005071 0.00005058 0.00004948 0.00004845 0.00004749 0.00004748 0.00004661 0.00004602 0.00004471 0.00004452 0.00004425 0.00004372 0.00004260 0.00004149 0.00004148 0.00004106 0.00004098 0.00004042 0.00003936 0.00003872 0.00003792 0.00003677 0.00003595 0.00003564 0.00003525 0.00003383 0.00003373 0.00003316 0.00003315 0.00003255 0.00003237 0.00003130 0.00003072 0.00002916 0.00002907 0.00002861 0.00002792 0.00002711 0.00002689 0.00002593 0.00002497 0.00002454 0.00002451 0.00002428 0.00002417 0.00002394 0.00002388 0.00002379 0.00002345 0.00002301 0.00002273 0.00002184 0.00002101 0.00002066 0.00002050 0.00001893 0.00001810 0.00001796 0.00001731 0.00001604 0.00001552 0.00001524 0.00001519 0.00001418 0.00001415 0.00001411 0.00001347 0.00001322 0.00001301 0.00001259 0.00001225 0.00001222 0.00001194 0.00001162 0.00001141 0.00001090 0.00001082 0.00001008	10.792901489479977	96.63913319733805
SRR25657442.tsv	[('XBB.1.5* [Omicron (XBB.1.5.X)]', 0.5712376190109424), ('XBB* (XBB.X)', 0.4279579508238204), ('Omicron', 0.00045020478598652787), ('XBB.1.16* [Omicron (XBB.1.16.X)]', 0.00035435689113206946)]	GG.1 XBB.1.41.1 XBB.1.5.45 HY.1 FP.3 FY.5 XBB.1.5.28 FA.1 GY.8 XBB.1.5.29 XBB.1.5.87 BA.2.10.4	0.14265265 0.14265265 0.14265265 0.14265265 0.14265265 0.14265265 0.14265265 0.00036246 0.00035436 0.00031951 0.00030750 0.00008774	0.6756699538361923	11.661037354111627
SRR25657385.tsv	[('XBB.1.9* [Omicron (XBB.1.9.X)]', 0.9984956646920105), ('XBB.1.5* [Omicron (XBB.1.5.X)]', 0.001006892153194896), ('XBB* (XBB.X)', 0.0003914256504812457), ('XBB.2.3* [Omicron (XBB.2.3.X)]', 0.00010449554981763244)]	EG.5 XBB.1.9.1 HQ.1 FL.1.2 FL.1 FL.23 XBB.1.5.73 FL.18 FL.1.5 FL.5 FL.10 FL.2.3.1 HP.1 FL.9 EG.5.2.3 XBB.1.22.2 FP.1 FL.4.2 XBB.1.5.57 FL.15 GM.1 FL.2.3 HK.2 FY.4.1.1 HL.2 FL.13 FL.23.1 FL.24 XBB.1.5.44 HA.2 XBB.1.42.2 EG.4.3 FL.22 XBB.1.5.54 GJ.1.1 EG.4.2 XBB.1.5.58	0.65654032 0.33910768 0.00033024 0.00032922 0.00032922 0.00030643 0.00028269 0.00025599 0.00021759 0.00019194 0.00018963 0.00017301 0.00016302 0.00012934 0.00012194 0.00011983 0.00010934 0.00010544 0.00010429 0.00009976 0.00008350 0.00007669 0.00007556 0.00006789 0.00006637 0.00006298 0.00006071 0.00005561 0.00004743 0.00004381 0.00002800 0.00002501 0.00002444 0.00002252 0.00002099 0.00001718 0.00001289	8.706312035538115	74.51760692907067
SRR25665839.tsv	[('XBB.1.9* [Omicron (XBB.1.9.X)]', 0.5257425265684794), ('XBB.1.5* [Omicron (XBB.1.5.X)]', 0.4146651186431818), ('XBB* (XBB.X)', 0.0584158362853866)]	EU.1.1 HA.2 EU.1 EG.4.4 EG.4.2 EG.4.3 EG.4.1 EG.6 EG.4 EG.8 FL.18.1 XBB.1.9.2 XBB.1.22.2	0.13822171 0.13822171 0.13822171 0.05841584 0.05841584 0.05841584 0.05841584 0.05841584 0.05841584 0.05841584 0.05841584 0.05841584 0.05841584	4.0697459912013745	25.562652576664547
SRR25665988.tsv	[('XBB.1.5* [Omicron (XBB.1.5.X)]', 0.9977420139025878)]	HZ.1 GN.1.1 XBB.1.5.10	0.98784102 0.00495049 0.00495049	1.4436003162323146	14.587165167374511
SRR25657488.tsv	[('XBB.1.16* [Omicron (XBB.1.16.X)]', 0.42874199987887707), ('XBB* (XBB.X)', 0.2526796752426035), ('XBB.1.9* [Omicron (XBB.1.9.X)]', 0.2073257459552561), ('XBB.1.5* [Omicron (XBB.1.5.X)]', 0.11026044803298592), ('Other', 0.0006521975448562171), ('Omicron', 0.00012795580922589527), ('XBB.2.3* [Omicron (XBB.2.3.X)]', 0.00011405891707962036), ('Alpha', 2.2736601816752185e-05), ('Delta', 2.1372417839722533e-05)]	XBB.1.16.6 XBB.1.22 FL.1.5 XBB.1.16.11 EG.6.1 GK.1.1 XBB.1.5.70 XBB.1.5.41 XBB.1.16.10 XBB.1.25 XBB.1.16.19 XBB.1.44.1 XBB.1.16.12 FY.2.1 XCF.1 HF.1 XBB.1.16.8 XBB.1.16.16 XBW FL.19.1 FH.1 FU.5 FU.2 HN.1 EK.3 XBB.1.16.14 XBB.1.16.9 HU.2 XBB.1.5.64 GY.3 XBB.1.37.1 HE.1 HC.1 FY.4.1.1 XBB.1.45.1 FL.18.1 GW.2 XBB.1.5.72 HP.1 XBB.1.26 FP.1 XBB.1.16.5 XBB.1.24.1 GK.1.3 XBB.1.22.3 GA.5 XBB.1.48 EU.1.1.1 XBB.1.16.13 EK.1 FL.23.1 B.1.641 FY.3.1 GJ.1.1 XBB.1.5.54 B.1.1.427 FL.4.2 HB.1 XBB.1.5.74 GB.1 XBB.1.5.85 CM.8.1.5 GM.1 FL.24 XBB.1.16.4 EG.5.2.2 XBB.1.5.58 GK.2 XBB.8.1 EG.9.1 B.1.369.1 G.1 GY.7 XBL.1 FE.1.2 DB.3 FL.3.4 GN.1.1 HT.1 GY.8 XBL.3.1 XBB.1.13.1 GW.5 BF.5.3 FY.1 Q.2 EG.4.4 FL.1.3 AY.134 XBB.2.3.5 GU.1 FR.1.3 HZ.3 B.1.177.61 B.1.640.2 XBB.2.9 XBB.1.12.1 GN.3 XAY.1.1.3 HR.1 B.1.438.4 C.2.1 FY.1.3 FL.2.3.1 B.1.1.445 XBB.1.32.1 XBJ.4 XBB.1.5.57	0.33650442 0.25018989 0.11884574 0.08906278 0.08784029 0.05899660 0.04906347 0.00103975 0.00100540 0.00066678 0.00066478 0.00039248 0.00023765 0.00018990 0.00017311 0.00016838 0.00016211 0.00016143 0.00015325 0.00014476 0.00012968 0.00012354 0.00011808 0.00010845 0.00010701 0.00010434 0.00010289 0.00009890 0.00009845 0.00009780 0.00009619 0.00009224 0.00008278 0.00008267 0.00007940 0.00007927 0.00007867 0.00007623 0.00007609 0.00007602 0.00007459 0.00007287 0.00006869 0.00006706 0.00006690 0.00006470 0.00006005 0.00005981 0.00005841 0.00005836 0.00005665 0.00005601 0.00005375 0.00005319 0.00005190 0.00005015 0.00004994 0.00004994 0.00004888 0.00004823 0.00004385 0.00004375 0.00004020 0.00003966 0.00003894 0.00003882 0.00003820 0.00003697 0.00003403 0.00003383 0.00003359 0.00003321 0.00003169 0.00003084 0.00003062 0.00003059 0.00002971 0.00002855 0.00002814 0.00002649 0.00002631 0.00002540 0.00002538 0.00002488 0.00002424 0.00002274 0.00002211 0.00002182 0.00002137 0.00002067 0.00002042 0.00001852 0.00001835 0.00001831 0.00001800 0.00001693 0.00001633 0.00001584 0.00001573 0.00001560 0.00001554 0.00001547 0.00001472 0.00001471 0.00001268 0.00001026 0.00001022 0.00001021	10.246384058428951	90.70327391900479
SRR25657257.tsv	[('XBB.1.16* [Omicron (XBB.1.16.X)]', 0.49987044958305726), ('XBB.1.9* [Omicron (XBB.1.9.X)]', 0.463385371188495), ('CH.1.1* [Omicron (CH.1.1.X)]', 0.03296504591965126), ('XBB* (XBB.X)', 0.0020476464830020634), ('Omicron', 0.0006989956552975625), ('XBB.1.5* [Omicron (XBB.1.5.X)]', 0.0006056141321128328), ('Other', 0.0002332240427061791), ('XBB.2.3* [Omicron (XBB.2.3.X)]', 6.282808490889459e-05), ('Alpha', 3.200359380360016e-05), ('A', 2.682491475662046e-05)]	XBB.1.16.9 FL.1.5.1 FL.16 EG.5.1.1 XBB.1.16 FL.5 HK.3 DV.7.1 EG.2 CH.1.1.29 EG.5.1 XBB.1.16.19 XBB.1.16.10 DV.7.2 FL.10 CH.1.1.16 XBB.1.12 XBB.1.44.1 XBB.1.16.15 FL.29 XBB.1.27 EG.5.1.2 FL.2.3.1 XBB.1.9.7 XBB.1.16.8 XBB.1.21 XBB.7 FL.19.1 CH.1.1.18 CH.1.1.27 EG.5.2.3 FU.2 CH.1.1.3 FL.4.2 HV.1 FL.23.1 HU.2 GP.3 XBB.1.16.16 GY.6 FP.2.1.1 FL.20 HR.1 XBB.3.5 GY.7 DV.2 XBB.1.16.5 FL.23 FL.18.1.1 GW.1 BA.4.1.7 DV.6.1 XBB.1.5.50 XBB.1.16.18 FL.24 EG.9.1 XBB.1.5.82 CH.1.1.20 FY.2.1 DV.8 FL.5.1 XBB.1.36 FL.26 BQ.1.25.1 GD.2 EG.6.1 FL.17.1 GN.1.1 DV.3.1 DV.4 XBB.1.31 XBB.1.32 FL.26.1 FL.21.1 FL.9 FL.13.3 FS.1 FK.1.2.2 FL.28 B.1.641 FL.22 HK.2 EK.2.1 EG.5.1.3 GY.8 XAW GY.3 FQ.1 HN.1 HH.1.1 FL.14 GU.1 CV.1 BL.1.2 HB.1 B.1.575.2 FL.2.2 GK.1.1 GW.5 DB.3 GB.2 FK.1.3.2 FL.3.1 XBB.1.9.5 XBB.1.9.6 BA.2.9.1 XBB.6.1 DV.1.1 XBB.1.16.4 EG.5.2.2 BS.1.2 EG.4.4 EP.1 FR.1.3 JB.2 HZ.1 XBB.8.1 AV.1 Q.2 BF.7.5.1 XBB.1.24.3 XBB.1.12.1 FK.1.4.1 FL.3.4 FY.7 XBB.1.5.85 CH.1.1.2 A.2.5.3 XBB.1.29 XBB.1.23 BA.5.1.38 BF.11.5 FL.7 BA.2.86 XBJ.2 B.1.258.22 BA.2.3.22 B.1.404 FL.12 BF.5.3 GJ.1.1 BG.1 XBB.1.40 CP.7 XBB.1.13.1 XBB.2.2 FU.2.1 GC.1 XBB.1.26 XBR CH.1.1.5 CM.4.1 FL.8 CA.3.1 GT.1 FY.3.1 B.1.640.2 XBB.1.5.87	0.43425000 0.14371244 0.13148200 0.06876083 0.06177992 0.04939476 0.04645032 0.02404485 0.01725400 0.00666667 0.00290150 0.00178771 0.00090148 0.00067075 0.00039950 0.00034684 0.00024935 0.00023559 0.00022936 0.00022290 0.00021213 0.00020559 0.00018854 0.00018694 0.00016788 0.00016572 0.00016424 0.00015515 0.00015199 0.00014953 0.00013767 0.00013378 0.00012951 0.00012866 0.00012601 0.00012128 0.00011599 0.00011428 0.00011200 0.00010355 0.00010222 0.00009888 0.00009648 0.00009282 0.00009266 0.00009258 0.00009202 0.00009153 0.00009152 0.00008768 0.00008610 0.00008183 0.00008156 0.00008037 0.00008006 0.00007832 0.00007784 0.00007764 0.00007069 0.00006982 0.00006674 0.00006453 0.00006359 0.00006299 0.00006082 0.00006037 0.00006005 0.00005958 0.00005950 0.00005864 0.00005846 0.00005801 0.00005550 0.00005516 0.00005225 0.00005194 0.00005175 0.00005167 0.00005122 0.00005101 0.00004986 0.00004929 0.00004876 0.00004601 0.00004455 0.00004449 0.00004415 0.00004385 0.00004356 0.00004334 0.00004264 0.00004236 0.00004163 0.00004157 0.00004138 0.00004014 0.00004012 0.00003946 0.00003887 0.00003836 0.00003824 0.00003756 0.00003742 0.00003675 0.00003647 0.00003647 0.00003620 0.00003611 0.00003603 0.00003545 0.00003507 0.00003476 0.00003470 0.00003457 0.00003377 0.00003320 0.00003304 0.00003240 0.00003200 0.00003193 0.00003134 0.00003119 0.00003071 0.00003035 0.00002997 0.00002885 0.00002846 0.00002682 0.00002670 0.00002598 0.00002535 0.00002408 0.00002364 0.00002244 0.00002228 0.00002166 0.00002165 0.00002102 0.00002038 0.00002022 0.00001949 0.00001875 0.00001801 0.00001673 0.00001604 0.00001548 0.00001502 0.00001499 0.00001497 0.00001437 0.00001435 0.00001337 0.00001265 0.00001250 0.00001192 0.00001107 0.00001057 0.00001051	11.422986245211561	97.58887068187138
SRR25665871.tsv	[('XBB* (XBB.X)', 0.9991761661174802), ('XBB.1.16* [Omicron (XBB.1.16.X)]', 0.0008237911607247543)]	FY.5 FU.4 XBB.1.16.10	0.99917617 0.00044662 0.00037717	2.33607286951404	30.38825535899408
SRR25645467.tsv	[('XBB.1.16* [Omicron (XBB.1.16.X)]', 0.39599463331338497), ('XBB* (XBB.X)', 0.25211713627821813), ('XBB.1.9* [Omicron (XBB.1.9.X)]', 0.19434424315945506), ('XBB.1.5* [Omicron (XBB.1.5.X)]', 0.09629650008143263)]	XBB.1.16 XBB.1.22 XBB.1.42.1 XBB.1.9.1 XBB.1.16.6 XBB.1.16.12 XBB.1.5.59 EG.5.1 XBB.1.5.35 EG.5.1.4 XBB.1.5.28 XBB.1.41.1 XBB.1.5.31 FL.29 FL.6 FE.1 FL.9 FY.4.1 HA.1 FU.5 XBB.1.5.82 XBB.1.16.19 XBB.1.5.81 FL.22 FL.2.3 XBB.1.5.72 XBB.1.16.4 GG.1 FY.3.1 FL.4.6 FL.4.1.1 XBB.1.5.94 EG.5.2 XBB.2.9 FL.24 XBB.1.5.36	0.20916181 0.13304341 0.10965001 0.10646282 0.10335200 0.07909907 0.06894469 0.06720555 0.00836078 0.00785320 0.00675714 0.00361795 0.00281215 0.00203416 0.00186208 0.00183122 0.00173051 0.00168779 0.00160883 0.00152999 0.00151228 0.00148810 0.00148007 0.00146786 0.00145594 0.00139860 0.00136366 0.00136077 0.00124440 0.00109739 0.00108899 0.00105559 0.00104516 0.00104236 0.00104058 0.00100560	15.08096435799197	99.254255425877
SRR25657374.tsv	[('XBB.1.9* [Omicron (XBB.1.9.X)]', 0.5744805640273235), ('XBB.1.16* [Omicron (XBB.1.16.X)]', 0.4218329999315498), ('XBB* (XBB.X)', 0.002941926766988908), ('XBB.1.5* [Omicron (XBB.1.5.X)]', 0.000403617865913717), ('Other', 0.00015212105058926213), ('Omicron', 9.558950795878122e-05), ('XBB.2.3* [Omicron (XBB.2.3.X)]', 8.058591449135787e-05)]	FL.2.2 HF.1 EG.5.1 XBB.1.16.12 FP.3 EG.6 EG.6.1 XBB.1.16.19 FL.2.3.1 FL.10 EG.5.1.3 XBB.1.16.15 EG.5.1.2 XBB.1.16.8 HK.2 EG.5.1.4 XBB.1.12 XBB.1.16.18 FL.18.1.1 XBB.1.16.6 FL.23.1 HU.2 FL.5.1 FL.9 HL.2 FY.1.1 FL.7 FL.10.1 HR.1 GW.1 HL.1 XBB.1.5.87 FL.4.1.1 FY.4.1 GB.2 FL.28 XBB.1.16.7 EG.4.1 HG.1 BA.2.53 EG.5.2.2 EU.1.1.1 FL.4.4 XBB.1.5.58 XBB.1.12.1 FL.21 XBB.1.19.2 G.1 XBB.2.3.5 B.1.641 EK.2.1 EU.1.1 EU.1.1.2 EK.1 XBB.1.16.14 B.1.1.330 FL.20.1 BA.4.1.8 CD.2 B.1.243.2 FL.22 EG.10.1 FW.3 B.1.438.4 FL.5 B.1.400.1	0.41861756 0.28231521 0.14998021 0.13770109 0.00215888 0.00201794 0.00100435 0.00088889 0.00041556 0.00039143 0.00032884 0.00030402 0.00026784 0.00025031 0.00022225 0.00020177 0.00018024 0.00015760 0.00014251 0.00012981 0.00012265 0.00011583 0.00010778 0.00010551 0.00010202 0.00009407 0.00009165 0.00008272 0.00007239 0.00006927 0.00006540 0.00006269 0.00006244 0.00006208 0.00006018 0.00005846 0.00005641 0.00004875 0.00004681 0.00004584 0.00004528 0.00004293 0.00003846 0.00003816 0.00003759 0.00003754 0.00003670 0.00003666 0.00003378 0.00003329 0.00003258 0.00003172 0.00003172 0.00003126 0.00002965 0.00002902 0.00002895 0.00002513 0.00002463 0.00002449 0.00002371 0.00002228 0.00001985 0.00001717 0.00001412 0.00001149	8.422757928068403	69.80904925927165
SRR25665984.tsv	[('XBB.1.9* [Omicron (XBB.1.9.X)]', 0.4485472647754764), ('XBB.1.16* [Omicron (XBB.1.16.X)]', 0.34762413020099425), ('XBB* (XBB.X)', 0.17941890591019063), ('Other', 0.02242736323877383)]	FU.2.1 FL.15 FL.10 FL.5 FL.2 FL.18 FL.3 FY.1.2 XCE FY.4 FL.13.3 FL.26.1 FL.21.1 FL.16 FL.22 FL.2.5 FL.2.3 FL.3.2 FY.4.1 FY.3.1 FL.13.2 FL.21 FL.25 FL.7 FY.3 XBB.1.22 XBB.1.9 XBB.1.23 XBB.1.22.1 XBB.1.9.4 XBB.1.9.5 FY.1 FY.5 XBB.1.9.1 FL.27 FY.1.1 FY.1.3 FY.2 FY.6 FL.13 FL.8 FL.26 FL.6 FL.13.1 FL.14 GY.2.1 FL.20 XBB.1.16.9 XBB.1.16.16 XBB.1.16.5 FU.1 FU.2 FU.3 XBB.1.16.2 XBB.1.16.13 FU.3.1 FU.5 FU.4 GY.6 GY.3 GY.4 GY.2 GY.5 GY.7 GY.1 GY.8 XBB.1.16.14 XBB.1.16.12 XBB.1.16.6 FL.2.2 FL.28 FL.11 FL.10.1 FY.4.2 XBB.1.9.7 FL.13.3.1 FL.21.2 FL.20.1 FL.3.3 XBB.1.16.11 FL.2.2.1 XCC XBB.1.16.19 XBB.1.16.20 XBB.1.16.21 XBB.1.16.17 XBB.1.16.3 XBB.1.16.1 XBB.1.26	0.01121368 0.01121368 0.01121368 0.01121368 0.01121368 0.01121368 0.01121368 0.01121368 0.01121368 0.01121368 0.01121368 0.01121368 0.01121368 0.01121368 0.01121368 0.01121368 0.01121368 0.01121368 0.01121368 0.01121368 0.01121368 0.01121368 0.01121368 0.01121368 0.01121368 0.01121368 0.01121368 0.01121368 0.01121368 0.01121368 0.01121368 0.01121368 0.01121368 0.01121368 0.01121368 0.01121368 0.01121368 0.01121368 0.01121368 0.01121368 0.01121368 0.01121368 0.01121368 0.01121368 0.01121368 0.01121368 0.01121368 0.01121368 0.01121368 0.01121368 0.01121368 0.01121368 0.01121368 0.01121368 0.01121368 0.01121368 0.01121368 0.01121368 0.01121368 0.01121368 0.01121368 0.01121368 0.01121368 0.01121368 0.01121368 0.01121368 0.01121368 0.01121368 0.01121368 0.01121368 0.01121368 0.01121368 0.01121368 0.01121368 0.01121368 0.01121368 0.01121368 0.01121368 0.01121368 0.01121368 0.01121368 0.01121368 0.01121368 0.01121368 0.01121368 0.01121368 0.01121368 0.01121368 0.01121368	0.04866256320500299	13.888238638263719
SRR25657439.tsv	[('XBB.1.16* [Omicron (XBB.1.16.X)]', 0.5125179999542343), ('XBB.1.9* [Omicron (XBB.1.9.X)]', 0.24741447600863406), ('XBB.1.5* [Omicron (XBB.1.5.X)]', 0.19520409406728478), ('XBB.2.3* [Omicron (XBB.2.3.X)]', 0.04291418030200389), ('XBB* (XBB.X)', 0.0011567028415852964), ('Other', 0.0005259597317430583), ('Omicron', 0.0001648083984731681), ('CH.1.1* [Omicron (CH.1.1.X)]', 3.458547182666768e-05), ('Theta', 2.8032801563155306e-05), ('Alpha', 1.2832840448769629e-05)]	XBB.1.16.3 XBB.1.5.18 EG.5 XBB.1.16.6 XBB.1.16.11 EG.5.1.4 XBB.1.9.1 XBB.2.3 EG.5.1.1 XBB.1.16.12 XBB.1.16 FL.1.5 XBB.1.5.95 XBB.1.16.10 XBB.1.5.67 EK.2 XBB.1.5.10 FL.3.1 XBB.1.16.14 HQ.1 FL.10 XBB.1.16.15 FL.2.3.1 XBB.1.16.7 XBB.1.44.1 FL.19.1 XBB.1.16.8 FL.23 FL.14 XBB.1.16.18 XBB.1.16.13 XBB.1.5.57 FL.13.3 FL.20.1 HJ.1 XCG FU.5 XBB.1.16.5 FL.5 FL.18.1 FL.21.1 FL.26 FH.1 FU.3.1 FL.4.6 XBB.2.9 FL.17.2 XBV XBB.1.16.16 XBB.1.5.74 FL.7 EG.5.2.3 HP.1 HN.1 XBB.1.5.5 GN.1.1 FL.24 HU.2 FL.23.1 FL.15 FE.1.1.2 XBB.1.16.4 XBB.1.5.64 GY.8 FL.9 XBB.3.2 GK.1.2 FL.28 GJ.1.1 GH.1 FY.2.1 GU.1 EU.1 BA.5.1.38 XBB.1.5.31 EG.5.2.1 XBB.1.24.1 FR.1.3 FP.2 GK.1.1 FP.1 XAW FZ.1 XBB.1.45.1 EG.4.1 XBB.1.34 EK.1 FL.22 XBB.3.3 XBL.3.1 XBB.1.19.2 HK.2 FL.26.1 XBB.1.5.68 EU.1.1.1 FK.1.3.2 XBB.2.3.10 XBB.1.5.50 XAY.1.1.3 HD.1 B.1.1.341 B.1.36.33 P.3 BA.2.86 HU.1 B.1.438.4 XAQ HZ.2 C.1.2 GA.5 XBB.1.5.47 FZ.2 GA.3 M.1 HC.1 XBB.1.5.46 EG.4.2 FY.4.1.1 Q.2 XBB.1.5.85	0.31472488 0.18988258 0.12180160 0.11571200 0.05302243 0.05170846 0.04291828 0.04281323 0.02572645 0.01348014 0.01211694 0.00122367 0.00104488 0.00102290 0.00086943 0.00083966 0.00059331 0.00055305 0.00051746 0.00035631 0.00035034 0.00029255 0.00029062 0.00028822 0.00023716 0.00023297 0.00023161 0.00022266 0.00021353 0.00020263 0.00018332 0.00017446 0.00017150 0.00015748 0.00015693 0.00015638 0.00015383 0.00014964 0.00014725 0.00014459 0.00014316 0.00014041 0.00013627 0.00013596 0.00013155 0.00013101 0.00012747 0.00012547 0.00012103 0.00012029 0.00011777 0.00011335 0.00011162 0.00010670 0.00010310 0.00010041 0.00009948 0.00009910 0.00009854 0.00009586 0.00008699 0.00008261 0.00008004 0.00007984 0.00007876 0.00006870 0.00006784 0.00006776 0.00006658 0.00006645 0.00006358 0.00006203 0.00005906 0.00005900 0.00005834 0.00005833 0.00005421 0.00005310 0.00005243 0.00004966 0.00004824 0.00004772 0.00004771 0.00004644 0.00004336 0.00004318 0.00004253 0.00003922 0.00003882 0.00003858 0.00003826 0.00003795 0.00003788 0.00003693 0.00003570 0.00003459 0.00003437 0.00003345 0.00003241 0.00003139 0.00002974 0.00002905 0.00002803 0.00002802 0.00002699 0.00002688 0.00002469 0.00002243 0.00002226 0.00002217 0.00002139 0.00002139 0.00001968 0.00001747 0.00001728 0.00001699 0.00001449 0.00001329 0.00001283 0.00001068	10.338112827616147	92.18138648296157
SRR25657425.tsv	[('XBB.1.16* [Omicron (XBB.1.16.X)]', 0.5593139985642196), ('XBB.1.5* [Omicron (XBB.1.5.X)]', 0.22228198075001035), ('XBB.1.9* [Omicron (XBB.1.9.X)]', 0.21614524355767842), ('XBB* (XBB.X)', 0.0013880971905773068), ('Other', 0.000558312849114728), ('XBB.2.3* [Omicron (XBB.2.3.X)]', 0.00017731956100956012), ('Omicron', 4.880714653437902e-05), ('CH.1.1* [Omicron (CH.1.1.X)]', 2.5080686020691867e-05), ('A', 2.172776738483161e-05)]	XBB.1.16.6 XBB.1.5.59 FL.2 XBB.1.16 XBB.1.16.9 FL.2.2 XBB.1.5.28 XBB.1.9.7 XBB.1.16.19 XBB.1.16.10 XBB.1.5.36 HS.1 FL.19.1 XBB.1.5.55 XBB.1.5.67 FL.2.2.1 FY.6 XBB.1.5.50 FL.2.3.1 HQ.1 XBB.1.5.10 XBB.1.16.8 XBB.1.5.1 FL.10 FL.27 GV.1 XBB.1.16.15 HY.1 FL.23 HA.2 EG.9.1 XBB.1.5.27 EU.1.1.1 FL.23.1 FL.5.1 FG.1 FL.4.1.1 FL.26 FU.1 FT.1 XBB.1.5.18 XCF XBB.1.45.1 XBB.1.16.14 XBB.1.16.16 FL.3.3 FU.5 HN.1 GW.1 XBB.1.5.44 GB.2 FL.16 FG.2 XAW GY.8 FH.1 FL.2.3 FL.28 HR.1 EK.2.1 GN.4 XBB.1.44.1 FY.4.1.1 GU.1 FL.20 XBW GD.3 XBB.1.5.75 FL.24 FL.18.1.1 XBB.1.16.5 GJ.1.1 EG.10.1 FD.2.1 XCC FL.21 HU.2 FL.1.5.1 EG.4.4 FP.2.1.2 XBB.1.5.5 EG.5.2.2 HJ.1 GS.1 EG.6.1 B.1.641 FL.22 XCD FU.3.1 XBB.1.5.81 FY.2.1 HM.1 FE.1.1.4 XBB.1.34 HK.2 FL.8 GN.3 XBB.1.5.85 FZ.1.1 FL.14 XBB.6.1 GK.1.3 FY.1.1 XBB.1.5.64 XBV XBB.1.5.3 XBB.1.22.3 XBB.1.5.47 FZ.2 HZ.1 XBB.1.9.6 HP.1.1 GY.2.1 XBB.1.16.4 GM.1 HE.1 XBB.1.19.2 HK.1 XBB.1.9.5 CM.12 HU.1.1 XBB.8.1 FK.1.3.2 XBB.1.24.3 GN.1 GN.1.1 XBB.1.5.58 A.30 FL.21.2 B.1.626 BA.2.86 XBB.1.5.80 B.1.616 XBB.2.3.1 FP.2.1 FY.1.3 FL.13.1 FW.3 FL.9 B.1.575.2 FL.15 XBB.2.3.5 FL.1.7 B.1.214.4 HW.1.1 XBB.1.5.21 XBB.1.43.1	0.38831996 0.17283063 0.13609597 0.09517214 0.06993460 0.06950867 0.04191724 0.00617676 0.00331858 0.00136991 0.00115514 0.00100632 0.00073493 0.00071259 0.00053863 0.00045103 0.00043535 0.00042234 0.00030093 0.00029788 0.00028169 0.00026126 0.00024511 0.00022824 0.00022543 0.00022075 0.00021570 0.00020946 0.00020634 0.00019523 0.00019313 0.00016483 0.00016479 0.00014866 0.00014692 0.00014520 0.00013597 0.00012685 0.00012022 0.00011603 0.00011589 0.00011584 0.00011581 0.00011180 0.00011011 0.00010779 0.00010683 0.00010393 0.00010386 0.00010375 0.00010183 0.00009655 0.00009479 0.00009436 0.00009125 0.00008805 0.00008700 0.00008700 0.00008668 0.00008252 0.00008144 0.00007929 0.00007674 0.00007552 0.00007471 0.00007425 0.00007356 0.00007255 0.00007145 0.00006811 0.00006467 0.00006303 0.00006270 0.00006065 0.00006062 0.00005949 0.00005871 0.00005722 0.00005685 0.00005576 0.00005534 0.00005442 0.00005264 0.00005081 0.00005061 0.00005012 0.00004956 0.00004873 0.00004868 0.00004858 0.00004748 0.00004675 0.00004532 0.00004496 0.00004413 0.00004399 0.00004395 0.00004281 0.00004150 0.00004120 0.00004108 0.00004105 0.00004053 0.00003938 0.00003917 0.00003774 0.00003733 0.00003713 0.00003713 0.00003683 0.00003517 0.00003504 0.00003452 0.00003377 0.00003355 0.00003308 0.00003280 0.00003249 0.00003095 0.00002923 0.00002772 0.00002769 0.00002508 0.00002505 0.00002458 0.00002261 0.00002184 0.00002173 0.00002158 0.00002157 0.00001958 0.00001953 0.00001919 0.00001775 0.00001676 0.00001660 0.00001619 0.00001616 0.00001589 0.00001400 0.00001253 0.00001218 0.00001036 0.00001024 0.00001022 0.00001002 0.00001001	9.898046249293174	90.54609905360667
SRR25726251.tsv	[('XBB.1.9* [Omicron (XBB.1.9.X)]', 0.8112910699690357), ('XBB.1.5* [Omicron (XBB.1.5.X)]', 0.1811799929250556), ('XBB* (XBB.X)', 0.0028789872215393185), ('XBB.2.3* [Omicron (XBB.2.3.X)]', 0.002264998761922998), ('Other', 0.00199291318394457), ('Omicron', 0.00024599854613017156), ('XBB.1.16* [Omicron (XBB.1.16.X)]', 0.0001385429794022976)]	XBB.1.5.59 FL.4 EG.5.1.6 XBB.1.9.1 FL.8 EG.5 HK.3 HV.1 XBB.2.3.12 XCF FL.1.5 FY.6 XBB.9 GN.1 FL.3.1 FL.10 XBB.2.3.10 FL.5.1 XBB.1.5.67 EG.6 FL.19.1 FL.29 FL.23 XBB.1.5.1 XBB.1.44.1 XBB.3.1 XCG FL.9 FL.2.3 FL.23.1 FL.1.3 XBB.1.3 XBB.1.5.77 EG.9.1 XBB.1.5.54 B.1.1.519 FY.4.1.1 FL.12 FU.1 FL.15 XBB.2.3.6 XBB.7 FL.4.2 XBB.1.36 XBB.1.5.8 HK.2 EG.6.1 EG.4.4 FL.17 FL.17.2 XBB.4 EG.5.2.3 ES.1 FZ.1 GN.4 FL.20 BG.1 FL.7 FL.4.4 GW.5 XCE XBB.1.5.9 XBB.1.24 FY.1 XBB.1.5.43 BA.5.2.51 EG.12 S.1 XBB.1.5.96 XBB.2.3.9 BA.2.10.4	0.17909762 0.17667971 0.14818906 0.10448697 0.10448697 0.10000181 0.09703135 0.07400668 0.00166480 0.00151286 0.00141690 0.00084005 0.00070579 0.00059294 0.00048918 0.00046350 0.00045551 0.00042845 0.00040728 0.00037226 0.00034043 0.00030834 0.00030586 0.00028439 0.00023288 0.00022914 0.00022784 0.00021127 0.00020272 0.00018290 0.00018054 0.00018008 0.00017832 0.00017094 0.00015028 0.00014868 0.00014689 0.00013860 0.00013854 0.00013497 0.00012613 0.00012452 0.00011972 0.00011819 0.00011813 0.00011545 0.00011286 0.00011067 0.00010739 0.00010731 0.00010554 0.00010246 0.00010152 0.00010070 0.00009706 0.00009022 0.00007969 0.00007795 0.00007756 0.00007073 0.00007021 0.00006846 0.00006695 0.00005824 0.00005549 0.00004878 0.00004008 0.00003332 0.00002934 0.00001856 0.00001600	6.309627665656926	81.38313881550346
SRR25657477.tsv	[('XBB.1.9* [Omicron (XBB.1.9.X)]', 0.40582772218094043), ('XBB.1.5* [Omicron (XBB.1.5.X)]', 0.23676807886616497), ('XBB.2.3* [Omicron (XBB.2.3.X)]', 0.17684315997475286), ('XBB.1.16* [Omicron (XBB.1.16.X)]', 0.16762872512090138), ('XBB* (XBB.X)', 0.0016035969964110928)]	XBB.1.9.7 XBB.1.5.72 XBB.1.16.1 XBB.2.3.11 EG.5.1.5 GE.1 XBB.1.5.28 EG.2 XBB.1.16 XBB.1.9.1 EG.5.1.6 FP.3 XBB.1.16.10	0.19526920 0.18005497 0.11497747 0.10588176 0.07879563 0.07096140 0.05671311 0.05233020 0.05152200 0.04500699 0.03442570 0.00160360 0.00112926	9.770953572990742	93.43544126007424
SRR25665873.tsv	[('XBB.1.16* [Omicron (XBB.1.16.X)]', 0.6695687465424317), ('XBB.1.9* [Omicron (XBB.1.9.X)]', 0.32984295059380375)]	EG.2 XBB.1.16.5 XBB.1.16.17 XBB.1.16.11 FU.2 XBB.1.16.21 XBB.1.16.1 XBB.1.16.3 FU.3 FU.3.1 XBB.1.16.6	0.32984295 0.07416601 0.07416601 0.07416601 0.07416601 0.07416601 0.07416601 0.07416601 0.07416601 0.07416601 0.00207469	2.233115350620274	42.7415309500719
