	summarized	lineages	abundances	resid	coverage
SRR25665936.tsv	[('XBB.1.5* [Omicron (XBB.1.5.X)]', 0.2558919231264036), ('Omicron', 0.2323691566495083), ('XBB* (XBB.X)', 0.21826075796075606), ('XBB.1.9* [Omicron (XBB.1.9.X)]', 0.10285851811943676), ('CH.1.1* [Omicron (CH.1.1.X)]', 0.08780605205317772), ('XBB.2.3* [Omicron (XBB.2.3.X)]', 0.04515739819877711), ('XBB.1.16* [Omicron (XBB.1.16.X)]', 0.03512242082127108), ('Other', 0.020315626066257093)]	BT.1 XBL.3.1 XBL.3 FU.1 XBB.1.11.1 XBB.1.22 XBB.1.25 XBB.1.44 XBB.1.45.1 XBB.1.14 XBB.1.28.1 XBB.1.41 XBB.1.5 XBB.1.36 XBB.2.1 XBB.1.38.1 XBB.2.6.1 XBB.2.6.3 XBN BN.1.2.5 BN.1.5.2 BN.1.5.1 CH.1.1.1 CH.1.1.7 CH.1.1.3 XBB.1.43.1 XBB.3.4 XBB.1.19.1 CJ.1 XBB.1.28 XBB.1.11 XBB.1.8 XBB.1.21 XBB.1.29 XBB.2.10 XBB.2.6 XBB.2.7.1 XBB.2.9 XBB.2.3 CA.3.1 CA.5 FR.1 CH.1.1 BM.1.1.4 XCA XBB.8.1 XBB.4.1 XBB.3.2 XBB.3.1 XBB.3.3 CH.1.1.18 XBB.1.13.1 BM.1.1.3 XBB.1.5.79 XBB.1.5.36 XBB.1.5.40 XBB.1.5.11 XBB.1.5.52 XBB.1.5.59 XBB.1.5.4 XBB.1.5.16 XBB.1.5.63 XBB.1.5.51 XBB.1.5.68 XBB.1.6 FP.2 FP.4 FP.3 XBB.2.2 GH.1 XBB.2.11.1 FR.2 FR.1.2 CH.1.1.11 CH.1.1.28 XBB.1.5.86 XBB.1.5.12 XBB.1.18 XBB.1.5.28 XBB.1.9 XBB.1.23 XBB.1.22.1 XBB.1.14.1 XBB.1.4.1 FW.1 FW.2 XBB.1.5.14 XBB.1.5.31 XBB.1.5.55 XBB.1.5.26 XBB.1.5.75 XBB.1.5.33 XBB.1.5.3 XBB.1.5.18 XBB.1.5.2 XBB.1.5.35 XBB.1.5.30 XBB.1.5.73 XBB.1.5.62 XBB.1.5.1 XBB.1.4 XBB.1.7 XBB.1.45 CA.6 BL.1.3 BL.1.1 BN.4 BN.1 BM.4.1 XBB BY.1.1 BY.1.2 BA.2.75.2 BN.3 BN.1.5 BN.1.10 BN.1.1 BN.1.7 BN.1.6 BM.2.1 BM.4.1.1 BR.1 XBB.1 XBB.2 BY.1.1.1 BL.5 BL.2 BL.3 BN.5 BA.2.75.1 BA.2.75.10 BA.2.75.5 BA.2.75.3 BA.2.75.7 BA.2.75.9 BA.2.75.6 BA.2.75.8 BL.1 BN.2 BY.1 BN.6 BM.2 BM.5 BM.4 BM.3 BM.2.3 BM.1 CB.1 BA.2.75.4 CA.3 CA.2 XBB.1.9.4 BL.1.4 CA.1 BN.3.1 BN.1.2.4 BN.1.2.3 BN.1.2.2 BN.1.2.6 CH.1 CH.3 BM.1.1.1 BR.5.1 BR.2.1 XBB.3.5 XBB.5 XBB.7 XBB.1.19 XBB.1.20 XBB.1.3 XBB.1.38 XBB.1.13 XBB.1.37 XBB.1.43 CA.7 BY.1.2.1 XBB.2.12 BR.1.2 BL.1.5 BN.1.2 BN.1.9 BN.1.1.1 XBU CH.2 BM.1.1 BR.5 BR.4 BR.2 XBB.2.7 XBB.8 XBB.4 XBB.3 XBB.9 XBB.1.10 XBB.2.8 XBB.2.11 XBB.2.4 XBB.2.5 CJ.1.3 XBB.1.9.3 XBB.1.9.5 EU.1.1.2 XBB.1.5.60 XBB.1.5.50 EK.3 EK.1 EK.2 XBL XBB.1.34.1 XBB.1.34.2 GF.1 GJ.1 CH.1.1.9 CH.1.1.20 CH.1.1.6 FJ.1 DV.4 FL.9 FL.14 FL.16 FL.1 FL.2.1 FL.17.1 XBB.1.5.41 GR.1 FH.1 FL.12 FK.1 CH.1.1.8 CH.1.1.23 CH.1.1.16 CH.1.1.5 FL.13 FL.8 FL.6 FL.7 FL.2 FD.3 FL.10 FL.4 FL.5 FL.17 FY.3.1 EU.1.1 GN.1 XBB.1.5.29 GK.1 FL.11 GB.1 CH.1.1.13 EK.2.1 GM.1 GM.2 DV.2 DV.1 DV.6 XBB.1.16.7 XBB.1.16.8 XBB.1.16.2 FU.2 XBB.1.42 FL.1.6 FL.1.4 FL.1.5.1 FL.2.2.1 FL.4.2 DV.7 DV.5 DV.6.2 DV.1.1 DV.8 DV.6.1 GU.1 FL.4.3 FL.4.1 XBB.1.16.1 XBL.2 XBL.1 GJ.1.1 GS.1 XBB.1.16.4 XBB.1.16.6 XBB.1.16.11 XBB.1.16.10 XBB.1.16.3 XBB.1.16.5 FL.10.1 FL.13.1 FL.15 XBB.1.9.7 FL.1.1 FL.1.2 FL.1.3 FL.1.5 FL.2.3 FL.2.2 GP.3 CH.1.1.14 FU.2.1 XBB.2.3.7 XBB.1.5.83 XBB.1.5.48 XBB.1.5.19 XBB.1.5.65 XBB.1.5.49 XBB.1.5.20 XBB.1.5.76 XBB.1.5.81 XBB.1.5.74 XBB.1.5.64 XBB.1.5.13 FG.3 FG.2 XBB.1.5.43 XBB.1.5.23 XBB.1.5.24 XBB.1.5.22 XBB.1.5.45 XBB.1.5.87 XBB.1.5.80 FP.1 XBB.1.5.84 XBB.1.5.25 XBB.1.5.6 XBB.1.5.85 XBB.1.9.6 FY.1 FY.3 FY.5 FY.2 FY.4 XBB.1.4.2 XBB.1.5.69 XBB.1.5.34 XBB.1.5.10 XBB.1.5.39 XBB.1.5.38 XBB.1.5.21 XBB.1.5.32 XBB.1.5.15 XBB.1.5.9 XBB.1.5.17 XBB.1.5.56 XBB.1.5.8 XBB.1.5.61 FP.2.1 XBB.2.3.6 GE.1 XBB.2.3.3 EU.1 XBB.1.5.70 GG.1 XBB.1.5.44 GC.2 GC.1 XBB.1.5.58 FD.4 XBB.1.5.5 XBB.1.5.46 XBB.1.5.77 XBB.1.5.42 XBB.1.5.27 XBB.1.5.37 EK.4 FG.1 XBB.1.5.57 XBB.1.34 XBB.2.3.5 XBB.2.3.8 XBB.2.3.2 EL.1 XCC FY.4.1 CH.1.1.19 XBB.2.3.12 XBB.2.3.11 XBB.2.3.10 XBB.2.3.4 XBB.2.3.9 FR.1.1 GP.2 GP.1 CH.1.1.17 CH.1.1.30 XCE GQ.1 CJ.1.2 CJ.1.1 CV.1 EP.1 XBB.1.16 XBB.1.9.1 GD.1 FY.1.1 BA.2.75	0.00909091 0.00263158 0.00263158 0.00250874 0.00250874 0.00250874 0.00250874 0.00250874 0.00250874 0.00250874 0.00250874 0.00250874 0.00250874 0.00250874 0.00250874 0.00250874 0.00250874 0.00250874 0.00250874 0.00250874 0.00250874 0.00250874 0.00250874 0.00250874 0.00250874 0.00250874 0.00250874 0.00250874 0.00250874 0.00250874 0.00250874 0.00250874 0.00250874 0.00250874 0.00250874 0.00250874 0.00250874 0.00250874 0.00250874 0.00250874 0.00250874 0.00250874 0.00250874 0.00250874 0.00250874 0.00250874 0.00250874 0.00250874 0.00250874 0.00250874 0.00250874 0.00250874 0.00250874 0.00250874 0.00250874 0.00250874 0.00250874 0.00250874 0.00250874 0.00250874 0.00250874 0.00250874 0.00250874 0.00250874 0.00250874 0.00250874 0.00250874 0.00250874 0.00250874 0.00250874 0.00250874 0.00250874 0.00250874 0.00250874 0.00250874 0.00250874 0.00250874 0.00250874 0.00250874 0.00250874 0.00250874 0.00250874 0.00250874 0.00250874 0.00250874 0.00250874 0.00250874 0.00250874 0.00250874 0.00250874 0.00250874 0.00250874 0.00250874 0.00250874 0.00250874 0.00250874 0.00250874 0.00250874 0.00250874 0.00250874 0.00250874 0.00250874 0.00250874 0.00250874 0.00250874 0.00250874 0.00250874 0.00250874 0.00250874 0.00250874 0.00250874 0.00250874 0.00250874 0.00250874 0.00250874 0.00250874 0.00250874 0.00250874 0.00250874 0.00250874 0.00250874 0.00250874 0.00250874 0.00250874 0.00250874 0.00250874 0.00250874 0.00250874 0.00250874 0.00250874 0.00250874 0.00250874 0.00250874 0.00250874 0.00250874 0.00250874 0.00250874 0.00250874 0.00250874 0.00250874 0.00250874 0.00250874 0.00250874 0.00250874 0.00250874 0.00250874 0.00250874 0.00250874 0.00250874 0.00250874 0.00250874 0.00250874 0.00250874 0.00250874 0.00250874 0.00250874 0.00250874 0.00250874 0.00250874 0.00250874 0.00250874 0.00250874 0.00250874 0.00250874 0.00250874 0.00250874 0.00250874 0.00250874 0.00250874 0.00250874 0.00250874 0.00250874 0.00250874 0.00250874 0.00250874 0.00250874 0.00250874 0.00250874 0.00250874 0.00250874 0.00250874 0.00250874 0.00250874 0.00250874 0.00250874 0.00250874 0.00250874 0.00250874 0.00250874 0.00250874 0.00250874 0.00250874 0.00250874 0.00250874 0.00250874 0.00250874 0.00250874 0.00250874 0.00250874 0.00250874 0.00250874 0.00250874 0.00250874 0.00250874 0.00250874 0.00250874 0.00250874 0.00250874 0.00250874 0.00250874 0.00250874 0.00250874 0.00250874 0.00250874 0.00250874 0.00250874 0.00250874 0.00250874 0.00250874 0.00250874 0.00250874 0.00250874 0.00250874 0.00250874 0.00250874 0.00250874 0.00250874 0.00250874 0.00250874 0.00250874 0.00250874 0.00250874 0.00250874 0.00250874 0.00250874 0.00250874 0.00250874 0.00250874 0.00250874 0.00250874 0.00250874 0.00250874 0.00250874 0.00250874 0.00250874 0.00250874 0.00250874 0.00250874 0.00250874 0.00250874 0.00250874 0.00250874 0.00250874 0.00250874 0.00250874 0.00250874 0.00250874 0.00250874 0.00250874 0.00250874 0.00250874 0.00250874 0.00250874 0.00250874 0.00250874 0.00250874 0.00250874 0.00250874 0.00250874 0.00250874 0.00250874 0.00250874 0.00250874 0.00250874 0.00250874 0.00250874 0.00250874 0.00250874 0.00250874 0.00250874 0.00250874 0.00250874 0.00250874 0.00250874 0.00250874 0.00250874 0.00250874 0.00250874 0.00250874 0.00250874 0.00250874 0.00250874 0.00250874 0.00250874 0.00250874 0.00250874 0.00250874 0.00250874 0.00250874 0.00250874 0.00250874 0.00250874 0.00250874 0.00250874 0.00250874 0.00250874 0.00250874 0.00250874 0.00250874 0.00250874 0.00250874 0.00250874 0.00250874 0.00250874 0.00250874 0.00250874 0.00250874 0.00250874 0.00250874 0.00250874 0.00250874 0.00250874 0.00250874 0.00250874 0.00250874 0.00250874 0.00250874 0.00250874 0.00250874 0.00250874 0.00250874 0.00250874 0.00250874 0.00250874 0.00250874 0.00250874 0.00250874 0.00250874 0.00250874 0.00250874 0.00250874 0.00250874 0.00250874 0.00250874 0.00250874 0.00250874 0.00250874 0.00250874 0.00250874 0.00250874 0.00250874 0.00250874 0.00250874 0.00250874 0.00250874 0.00250874 0.00250874 0.00250874 0.00250874 0.00250874 0.00250874 0.00250874 0.00250874 0.00250874 0.00250874 0.00250874 0.00250874 0.00250874 0.00250874 0.00250874 0.00250874 0.00250874 0.00250874 0.00250874 0.00250874 0.00250874 0.00250874 0.00250874 0.00250874 0.00250874 0.00250874 0.00250874 0.00250874 0.00250874 0.00250874 0.00250874 0.00250874 0.00250874 0.00250874 0.00250874 0.00250874 0.00250874 0.00250874 0.00250874 0.00250874	0.00783163380980645	4.631642310136106
SRR25657502.tsv	[('XBB.1.5* [Omicron (XBB.1.5.X)]', 0.4808615881492092), ('XBB.1.9* [Omicron (XBB.1.9.X)]', 0.295919244046756), ('XBB.1.16* [Omicron (XBB.1.16.X)]', 0.21524214310189455)]	GV.1 FU.2 EG.2 XBB.1.5.10 EG.5 FL.1.2 FL.1 XBB.1.9.2 XBB.1.5.66	0.35583800 0.21524214 0.13585348 0.11314359 0.06527463 0.03641891 0.03641891 0.02195330 0.01188000	8.744024989606153	93.8300504966057
SRR25665863.tsv	[('XBB.1.16* [Omicron (XBB.1.16.X)]', 0.9991876519596461)]	XBB.1.16.10 XBB.1.16.5 XBB.1.16.3	0.33306255 0.33306255 0.33306255	3.2866669197310037	22.556265257666453
SRR25665895.tsv	[('XBB.1.5* [Omicron (XBB.1.5.X)]', 0.9982755324925912)]	XBB.1.5.44	0.99827553	2.878329415356518	13.66418085141959
SRR25665869.tsv	[('Omicron', 0.9982521475014394)]	BA.2.10.4 BA.4.8 BA.2.75.7 BA.2.79	0.45154900 0.28191324 0.16616007 0.09862983	22.612571388831928	59.5625856937431
SRR25657486.tsv	[('XBB.1.9* [Omicron (XBB.1.9.X)]', 0.5238670001410862), ('XBB* (XBB.X)', 0.26200598753941645), ('XBB.1.5* [Omicron (XBB.1.5.X)]', 0.20715090163723845)]	FL.1.5.1 XBB.1.30 XBB.1.5.1 XBB.1.5.51	0.52386700 0.26200599 0.20536572 0.00178518	5.903282978141939	52.563287964418286
SRR25657347.tsv	[('XBB.1.16* [Omicron (XBB.1.16.X)]', 0.45537800999359324), ('XBB.1.9* [Omicron (XBB.1.9.X)]', 0.316238047345799), ('XBB.1.5* [Omicron (XBB.1.5.X)]', 0.17809631048475622), ('XBB* (XBB.X)', 0.03767560562362586)]	XBB.1.16.6 EG.5 FL.6 XBB.1.9.1 XBB.1.42 XBB.1.5.14 XBB.1.5.33 XBB.1.5.30 XBB.1.5.12 XBB.1.5.86 XBB.1.5.11 XBB.1.5.4 XBB.1.5.16 XBB.1.5.63 FG.3 FG.2 XBB.1.5.24 XBB.1.5 XBB.1.5.55 XBB.1.11.1 XBB.1.5.36 XBB.1.16.10	0.45423200 0.18830419 0.06396693 0.06396693 0.03565070 0.01342106 0.01342106 0.01342106 0.01342106 0.01342106 0.01342106 0.01342106 0.01342106 0.01342106 0.01342106 0.01342106 0.01342106 0.01342106 0.00221402 0.00202490 0.00140845 0.00114601	8.94783053650279	81.07882152292412
SRR25657444.tsv	[('XBB.1.5* [Omicron (XBB.1.5.X)]', 0.5293958614239689), ('XBB* (XBB.X)', 0.18271311758876224), ('XBB.1.16* [Omicron (XBB.1.16.X)]', 0.15919380754614476), ('XBB.1.9* [Omicron (XBB.1.9.X)]', 0.12202395700027338)]	GV.1 XBB.1.5.28 XBB.1.22 FL.7 XBB.1.16.6 XBB.1.16.3 XBB.1.42 FP.3 XBB.1.16.10	0.31071605 0.21867981 0.15900274 0.12202396 0.12095099 0.03717172 0.02122551 0.00248487 0.00107110	9.991981474718198	87.46279637494565
SRR25657541.tsv	[('XBB.1.16* [Omicron (XBB.1.16.X)]', 0.999088051360355)]	XBB.1.16.1 XBB.1.16.10	0.99791341 0.00117464	5.195150968665444	81.93826706350534
SRR25657480.tsv	[('XBB.1.5* [Omicron (XBB.1.5.X)]', 0.5655061492939806), ('XBB.1.9* [Omicron (XBB.1.9.X)]', 0.2686724892870625), ('XBB.1.16* [Omicron (XBB.1.16.X)]', 0.08682853694097373), ('XBB.2.3* [Omicron (XBB.2.3.X)]', 0.07396297628980741)]	XBB.1.5.10 XBB.1.5.28 FL.1.5.1 EG.2 XBB.1.16.11 GJ.1 EG.5.1 XBB.1.5.72 GU.1 GV.1 XBB.1.16.10	0.34443843 0.14041748 0.11128686 0.08960440 0.08577844 0.07396298 0.06778123 0.06703340 0.01149820 0.00211864 0.00105010	10.309491848951698	96.45520516336154
SRR25657259.tsv	[('XBB.1.9* [Omicron (XBB.1.9.X)]', 0.2590174086407252), ('XBB.1.5* [Omicron (XBB.1.5.X)]', 0.23833337927481307), ('XBB* (XBB.X)', 0.1924338058568523), ('XBB.2.3* [Omicron (XBB.2.3.X)]', 0.18064511310818523), ('XBB.1.16* [Omicron (XBB.1.16.X)]', 0.11905887007875945)]	XBB.1.5.28 FL.1.5.1 XBB.2.3.11 XBB.1.22 XBB.1.16.6 XBB.2.4 EG.2 EG.5.1 XBB.1.16.10	0.23833338 0.22020900 0.18064511 0.15134178 0.11798360 0.04109203 0.02640450 0.01240391 0.00107527	10.459862990335449	94.31495167708925
SRR25665937.tsv	[('XBB.1.16* [Omicron (XBB.1.16.X)]', 0.9990867635747889)]	XBB.1.16.6	0.99908676	1.0504732574639977	19.182021870715314
SRR25645465.tsv	[('XBB* (XBB.X)', 0.3940119151690416), ('XBB.1.5* [Omicron (XBB.1.5.X)]', 0.3367095625373462), ('XBB.1.9* [Omicron (XBB.1.9.X)]', 0.11892429589172439), ('Omicron', 0.04323224702787686), ('Other', 0.030650235548804267), ('XBB.2.3* [Omicron (XBB.2.3.X)]', 0.003185011147012429), ('XBB.1.16* [Omicron (XBB.1.16.X)]', 0.0011232058445632956)]	XBB.1.22 XBB.1.5.28 XBB.1.42 FD.2 FL.10 GV.1 BA.2.75.7 XCC FL.10.1 XBB.2.5 XBB.1.5.1 XBB.1.5.37 FY.5 XBB.1.5.27 CJ.1.3 BN.5 GJ.1 XBB.8.1 XBB.2.9 FL.2.3 GG.1 BN.3.1 XBB.1.5.61 XBB.1.5.62 XBB.1.19 XBB.1.5.45 BN.1.10 BN.1.4.5 XBB.7 XBB.1.5.76 BN.6 XBN XBB.2.3.8 XBB.1.5.74 XBB.1.16.7 FY.2 FL.2.2 XBL.1	0.23488676 0.13048360 0.12628139 0.10847862 0.09331034 0.06526280 0.03303747 0.02845060 0.02279707 0.02190400 0.01753522 0.00383877 0.00360231 0.00321602 0.00263852 0.00243665 0.00203194 0.00194013 0.00184574 0.00177549 0.00158447 0.00145044 0.00138696 0.00130444 0.00127540 0.00126396 0.00124203 0.00123609 0.00123125 0.00121704 0.00119104 0.00117763 0.00115307 0.00113766 0.00112321 0.00104493 0.00104139 0.00102200	16.614510197669055	99.2943851787446
SRR25657420.tsv	[('XBB.1.16* [Omicron (XBB.1.16.X)]', 0.9993160715258854)]	XBB.1.16.6 FU.2 XBB.1.16.7 XBB.1.16.11 XBB.1.16.10	0.50000000 0.47462300 0.01053494 0.01053494 0.00362319	4.492929124569725	27.950372872287062
SRR25657453.tsv	[('XBB.1.9* [Omicron (XBB.1.9.X)]', 0.37452594371142595), ('XBB* (XBB.X)', 0.3373089999995025), ('XBB.1.5* [Omicron (XBB.1.5.X)]', 0.23678236668794345), ('XBB.1.16* [Omicron (XBB.1.16.X)]', 0.027982507451325682), ('XBB.2.3* [Omicron (XBB.2.3.X)]', 0.014768880180608122)]	EG.5.1 XBB.1.42 XBB.1.5.10 FE.1.1.1 FL.1.5.1 XBB.1.5.57 FU.2 FL.1.5 XBB.2.3 XBB.1.9.1 XBB.2.3.8 XBB.1.16.10	0.28214486 0.20377100 0.17827900 0.13353800 0.06565280 0.05850337 0.02693330 0.01984620 0.01371713 0.00688208 0.00105175 0.00104921	10.116315131008896	96.32143932046952
SRR25665933.tsv	[('XBB.1.5* [Omicron (XBB.1.5.X)]', 0.8849296149435582), ('XBB* (XBB.X)', 0.11245946145196353)]	XBB.1.5.28 XBB.1.5.27 XBB.1.5.24 XBB.1.5.23 FP.4 XBB.1.15.1 XBB.1.11.1	0.40497832 0.40497832 0.03748649 0.03748649 0.03748649 0.03748649 0.03748649	2.5531929199778647	41.009263284620275
SRR25665919.tsv	[('XBB* (XBB.X)', 0.6823741563849104), ('XBB.1.5* [Omicron (XBB.1.5.X)]', 0.3147703999258893)]	FY.3.1 XBB.1.5.22 XBB.1.5.24 XBB.1.5.23 XBB.1.5.43 XBB.1.47.1 FY.3 FY.1 XBB.1.22.1 XBB.1.22 XBB.2.9 XBB.2.4 XBB.1.22.2 FY.4	0.07869260 0.07869260 0.07869260 0.07869260 0.07869260 0.07869260 0.07869260 0.07869260 0.07869260 0.07869260 0.07869260 0.07869260 0.04757020 0.00526316	3.828369642022716	46.450188944253085
SRR25665886.tsv	[('XBB.1.9* [Omicron (XBB.1.9.X)]', 0.6339052194316959), ('XBB* (XBB.X)', 0.19017156582950856), ('XBB.1.16* [Omicron (XBB.1.16.X)]', 0.1584763048579238), ('XBB.1.5* [Omicron (XBB.1.5.X)]', 0.01584763048579238)]	EG.5.1.1 FY.1.2 FL.2.1 FL.16 FL.14 FL.17 FL.5 FL.4 FL.10 FL.2 FL.12 FL.7 FL.8 FL.13 FY.4.1 FY.1.1 FL.17.1 GD.1 XBB.1.9.1 FY.4 FY.2 FY.5 FY.1 XBB.1.9.3 XBB.1.9.5 XBB.1.9.4 XBB.1.22.2 XBB.1.22.1 XBB.1.23 XBB.1.9 FL.17.2 GB.1 FU.1 EG.4 EG.5.1 EG.1.1 EG.1.3 FU.2.1 EG.5.2 EG.1.4 EG.1.2 EG.3 FL.2.2.1 XBB.1.42 EG.5 EG.7 EG.1 FU.2 XBB.1.16.6 XBB.1.16.2 XBB.1.16.9 FL.4.3 FL.4.1 FL.10.1 FL.2.2 FL.2.3 XBB.1.9.2 FL.15 XBB.1.16.1 XBB.1.16.3 XBB.1.16.10 XBB.1.16.11 XBB.1.22	0.01584763 0.01584763 0.01584763 0.01584763 0.01584763 0.01584763 0.01584763 0.01584763 0.01584763 0.01584763 0.01584763 0.01584763 0.01584763 0.01584763 0.01584763 0.01584763 0.01584763 0.01584763 0.01584763 0.01584763 0.01584763 0.01584763 0.01584763 0.01584763 0.01584763 0.01584763 0.01584763 0.01584763 0.01584763 0.01584763 0.01584763 0.01584763 0.01584763 0.01584763 0.01584763 0.01584763 0.01584763 0.01584763 0.01584763 0.01584763 0.01584763 0.01584763 0.01584763 0.01584763 0.01584763 0.01584763 0.01584763 0.01584763 0.01584763 0.01584763 0.01584763 0.01584763 0.01584763 0.01584763 0.01584763 0.01584763 0.01584763 0.01584763 0.01584763 0.01584763 0.01584763 0.01584763 0.01584763	0.01739502151381233	7.09962211149383
SRR25657406.tsv	[('XBB.1.9* [Omicron (XBB.1.9.X)]', 0.9902610159422969), ('XBB.1.5* [Omicron (XBB.1.5.X)]', 0.0021231401427385522), ('XBB* (XBB.X)', 0.0010402200031050849)]	XBB.1.9.2 EG.3 EG.7 GB.1 XBB.4.1 EG.5.1	0.32974330 0.32974330 0.32974330 0.00212314 0.00104022 0.00103112	2.5748079377074693	27.110992208139653
SRR25665917.tsv	[('XBB.2.3* [Omicron (XBB.2.3.X)]', 0.9996891266869778)]	XBB.2.3	0.99968913	1.3280350205040525	28.39180015383072
SRR25665894.tsv	[('XBB.1.5* [Omicron (XBB.1.5.X)]', 0.998306594878138)]	GR.1 XBB.1.5.62 XBB.1.5.10 XBB.1.5.63 XBB.1.5.4 XBB.1.5.66 XBB.1.5.59 XBB.1.5.52 XBB.1.5.36 XBB.1.5.79 XBB.1.5.73 FH.1 XBB.1.5.35 XBB.1.5.2 XBB.1.5.3 XBB.1.5.33 XBB.1.5.75 XBB.1.5.26 XBB.1.5.55 XBB.1.5.7 XBB.1.5.54 XBB.1.5.21 XBB.1.5.9 XBB.1.5.17 XBB.1.5.37 XBB.1.5.42 XBB.1.5.77 XBB.1.5.46 XBB.1.5.64 XBB.1.5.76 XBB.1.5.49 XBB.1.5.78 XBB.1.5.65 XBB.1.5.19 XBB.1.5.48 XBB.1.5.83 XBB.1.5.6 XBB.1.5.39 XBB.1.5.61 XBB.1.5.8 XBB.1.5.56 XBB.1.5	0.02376920 0.02376920 0.02376920 0.02376920 0.02376920 0.02376920 0.02376920 0.02376920 0.02376920 0.02376920 0.02376920 0.02376920 0.02376920 0.02376920 0.02376920 0.02376920 0.02376920 0.02376920 0.02376920 0.02376920 0.02376920 0.02376920 0.02376920 0.02376920 0.02376920 0.02376920 0.02376920 0.02376920 0.02376920 0.02376920 0.02376920 0.02376920 0.02376920 0.02376920 0.02376920 0.02376920 0.02376920 0.02376920 0.02376920 0.02376920 0.02376920 0.02376920	2.2336037748185467	28.589104772096444
SRR25657423.tsv	[('XBB.1.16* [Omicron (XBB.1.16.X)]', 0.46940649351672165), ('XBB* (XBB.X)', 0.3288634658815705), ('XBB.2.3* [Omicron (XBB.2.3.X)]', 0.1533306118775284), ('XBB.1.9* [Omicron (XBB.1.9.X)]', 0.03925149884271979), ('XBB.1.5* [Omicron (XBB.1.5.X)]', 0.0016447125636699542)]	XBB.1.22 XBB.1.16.11 XBB.1.16.6 XBB.2.3.2 XBB.1.16 FY.4 FL.1.5 FL.17 XBB.1.5.51 XBB.1.23 FL.10	0.28172676 0.20344800 0.18008049 0.15333061 0.08587800 0.04597180 0.03536375 0.00275482 0.00164471 0.00116491 0.00113293	6.504494815802486	50.209009129518776
SRR25645466.tsv	[('XBB* (XBB.X)', 0.47615700461773336), ('XBB.1.16* [Omicron (XBB.1.16.X)]', 0.2784655937729224), ('XBB.1.5* [Omicron (XBB.1.5.X)]', 0.1439187159974276), ('XBB.1.9* [Omicron (XBB.1.9.X)]', 0.03051989033647552), ('XBB.2.3* [Omicron (XBB.2.3.X)]', 0.009659730442100703), ('Other', 0.0015513099965699792)]	XBB.1.22.2 XBB.1.16 XBB.1.5.65 XBB.1.42 EU.1 XBB.1.16.1 EG.5.1 XBB.1.5.28 XBB.2.3 FL.1.5.1 XBB.1.16.6 FE.1.2 XBB.1.37.1 XBB.1.5.57 XBB.2.9 FY.4.1 XCF XBB.1.5.80 XBB.1.19 XBB.1.5.31 XBB.1.45.1 XBB.1.5.27 FL.2.2 XBB.1.5.62 XBB.8.1 XBB.1.24 XBB.1.5.63 FT.1	0.43692643 0.25206094 0.09676798 0.02721928 0.02703381 0.02430430 0.02405095 0.01126086 0.00965973 0.00529915 0.00210035 0.00195702 0.00189651 0.00179388 0.00176444 0.00163934 0.00155131 0.00138532 0.00133120 0.00129093 0.00123499 0.00117786 0.00116979 0.00111552 0.00110031 0.00108748 0.00105522 0.00103734	16.594665389137344	99.2375346955155
SRR25665920.tsv	[('XBB.1.5* [Omicron (XBB.1.5.X)]', 0.9984199048953754)]	EK.2.1 GG.1 XBB.1.5.81 XBB.1.5.28 XBB.1.5.18 XBB.1.5.67 XBB.1.5.11 XBB.1.5.36 XBB.1.5.86 XBB.1.5.2 XBB.1.5.33 XBB.1.5.3 XBB.1.5.59 XBB.1.5.75 XBB.1.5.26 XBB.1.5.55 XBB.1.5.7 XBB.1.5.14 XBB.1.5.52 XBB.1.5.10 XBB.1.5.63 XBB.1.5.83 EK.3 XBB.1.5.80 XBB.1.5.13 XBB.1.5.49 XBB.1.5.65 XBB.1.5.19 XBB.1.5.25 EK.2 XBB.1.5.39 XBB.1.5.9 XBB.1.5.32 XBB.1.5.21 XBB.1.5.54 XBB.1.5.38 XBB.1.5	0.14134206 0.14134206 0.14134206 0.14134206 0.01312278 0.01312278 0.01312278 0.01312278 0.01312278 0.01312278 0.01312278 0.01312278 0.01312278 0.01312278 0.01312278 0.01312278 0.01312278 0.01312278 0.01312278 0.01312278 0.01312278 0.01312278 0.01312278 0.01312278 0.01312278 0.01312278 0.01312278 0.01312278 0.01312278 0.01312278 0.01312278 0.01312278 0.01312278 0.01312278 0.01312278 0.01312278 0.01312278	2.762242450510449	40.54108283449821
SRR25665874.tsv	[('XBB.1.9* [Omicron (XBB.1.9.X)]', 0.9991021208594283)]	EG.2 FL.1.5.1 XBB.1.9.7 XBB.1.9.2 XBB.1.9	0.47874016 0.32165600 0.15758531 0.03893584 0.00218481	2.9541847695888936	56.502692037588204
SRR25657476.tsv	[('XBB* (XBB.X)', 0.5136528460381189), ('XBB.1.16* [Omicron (XBB.1.16.X)]', 0.45125916674916766), ('XBB.1.5* [Omicron (XBB.1.5.X)]', 0.0225665444310681)]	XBB.1.18.1 XBB.1.16 XBB.1.16.6 XBB.1.22 XBB.1.5.12 XBB.1.16.10	0.37976385 0.30760788 0.14252473 0.13388899 0.02256654 0.00112656	8.992716310698487	86.89094739658228
SRR25657465.tsv	[('XBB.1.5* [Omicron (XBB.1.5.X)]', 0.5769045623781827), ('XBB* (XBB.X)', 0.4174521030203979)]	XBB.1.5.28 XBB.1.41	0.57690456 0.41745210	9.243782312924496	97.16750827676152
SRR25657415.tsv	[('XBB.1.9* [Omicron (XBB.1.9.X)]', 0.33244528188194783), ('XBB.1.5* [Omicron (XBB.1.5.X)]', 0.2115786671672188), ('XBB* (XBB.X)', 0.2066397698042326), ('XBB.2.3* [Omicron (XBB.2.3.X)]', 0.15031573497079365), ('XBB.1.16* [Omicron (XBB.1.16.X)]', 0.08624467724089971)]	XBB.1.22 XBB.1.5.10 EG.5.1 EG.5.1.1 XBB.1.16.6 XBB.2.3.4 XBB.2.3 FL.1.5 FD.3 XBB.1.9.1 FL.15	0.20663977 0.18541500 0.16592794 0.08751740 0.08624468 0.08270444 0.06761130 0.06136085 0.02616367 0.01595913 0.00167997	12.453907254792108	96.50536735444604
SRR25657458.tsv	[('XBB.1.9* [Omicron (XBB.1.9.X)]', 0.40437184628624206), ('XBB.2.3* [Omicron (XBB.2.3.X)]', 0.2602608409359334), ('XBB.1.5* [Omicron (XBB.1.5.X)]', 0.21713459133548788), ('XBB.1.16* [Omicron (XBB.1.16.X)]', 0.06384509999163475), ('XBB* (XBB.X)', 0.049680112021652775)]	EG.5 XBB.2.3 XBB.1.5.59 XBB.1.5.28 XBB.1 FU.2.1 XBB.1.5.39 EG.2 FU.1 EG.5.1 GE.1 XBB.1.5.51 XBB.6.1	0.37114569 0.25807743 0.11391989 0.07081440 0.04816035 0.04512820 0.03086420 0.02774885 0.01871690 0.00547731 0.00218341 0.00153610 0.00151976	4.3162702929696355	61.93358525900411
SRR25665865.tsv	[('XBB.2.3* [Omicron (XBB.2.3.X)]', 0.6878165653574914), ('XBB* (XBB.X)', 0.31009632455435404)]	GJ.1 XBB.1.22	0.68781657 0.31009632	7.873558252750335	68.22726816707353
SRR25657372.tsv	[('XBB* (XBB.X)', 0.6184498200349869), ('XBB.1.9* [Omicron (XBB.1.9.X)]', 0.3688323587593907), ('XBB.1.16* [Omicron (XBB.1.16.X)]', 0.001284809998100126), ('XBB.1.5* [Omicron (XBB.1.5.X)]', 0.001115019877147524)]	XBB.1.22 FL.2 FY.5 XBB.1.16.10 EK.2.1	0.61691843 0.36883236 0.00153139 0.00128481 0.00111502	8.372546734735607	66.94646022138247
SRR25665900.tsv	[('XBB.1.16* [Omicron (XBB.1.16.X)]', 0.5131959951171107), ('XBB.1.9* [Omicron (XBB.1.9.X)]', 0.2667944970399129), ('XBB.1.5* [Omicron (XBB.1.5.X)]', 0.2187830742012534)]	XBB.1.16.1 GB.2 FL.4.3 FL.2.1 FL.5 FL.4 FL.10 FL.2 FL.12 FL.6 FL.8 FL.13 XBB.1.9.1 XBB.1.16.6	0.51119999 0.21878307 0.02425405 0.02425405 0.02425405 0.02425405 0.02425405 0.02425405 0.02425405 0.02425405 0.02425405 0.02425405 0.02425405 0.00199600	8.064715782253646	35.55161689462596
SRR25657462.tsv	[('XBB.1.5* [Omicron (XBB.1.5.X)]', 0.6373432169090452), ('XBB.1.9* [Omicron (XBB.1.9.X)]', 0.3081705968978302), ('XBB* (XBB.X)', 0.04564798472009528)]	XBB.1.5.55 EG.5.1 XBB.1.22 FP.3	0.63734322 0.30817060 0.04415824 0.00148975	11.074762667536342	76.78159382001806
SRR25657391.tsv	[('XBB.1.16* [Omicron (XBB.1.16.X)]', 0.4111603291564209), ('XBB.1.9* [Omicron (XBB.1.9.X)]', 0.32284155085676086), ('XBB.1.5* [Omicron (XBB.1.5.X)]', 0.17957068707865037), ('XBB.2.3* [Omicron (XBB.2.3.X)]', 0.07471177822259362)]	XBB.1.16.6 EG.5.1 FU.2 XBB.1.5.28 XBB.2.3.11 FL.1.5.1 EG.2 XBB.1.5.45 XBB.1.5.13 XBB.1.16.10	0.24200400 0.22447774 0.16782838 0.14752867 0.07471178 0.06781070 0.03055311 0.02063119 0.01141083 0.00132795	9.820136254831848	95.89338862321506
SRR25657513.tsv	[('XBB.1.9* [Omicron (XBB.1.9.X)]', 0.6158204455467036), ('XBB.1.5* [Omicron (XBB.1.5.X)]', 0.1736468357358833), ('XBB.1.16* [Omicron (XBB.1.16.X)]', 0.13091191538764538), ('XBB* (XBB.X)', 0.06705576677548324)]	XBB.1.9.1 EG.5.1.1 XBB.1.5.28 XBB.1.16 EG.2 EG.5.1 XBB.2.4 EG.1 FL.1.5.1	0.19190214 0.18693800 0.17364684 0.13091192 0.12477962 0.08511700 0.06705577 0.02256818 0.00451550	10.59047031059388	98.54195231247701
SRR25657351.tsv	[('XBB.1.9* [Omicron (XBB.1.9.X)]', 0.6314309994678713), ('XBB.1.5* [Omicron (XBB.1.5.X)]', 0.2512951004952808), ('XBB.2.3* [Omicron (XBB.2.3.X)]', 0.11215841584835413)]	FL.1.5.1 XBB.2.3.1 GV.1 XBB.1.5.28 XBB.1.5.10 XBB.1.5.59	0.63143100 0.11215842 0.07495235 0.07495235 0.05069520 0.05069520	9.706806399868206	51.707186569909375
SRR25657431.tsv	[('XBB.1.5* [Omicron (XBB.1.5.X)]', 0.6107722749688285), ('XBB.1.9* [Omicron (XBB.1.9.X)]', 0.1653523767895528), ('XBB.1.16* [Omicron (XBB.1.16.X)]', 0.16104490661841195), ('XBB.2.3* [Omicron (XBB.2.3.X)]', 0.05461312439559506)]	XBB.1.5.10 XBB.1.16.6 EG.5 XBB.2.3 XBB.1.5.28 XBB.1.5.66 FL.1.5.1 FL.14 XBB.1.16.10	0.55098900 0.16002251 0.15477167 0.05461312 0.04947056 0.01031271 0.00952496 0.00105574 0.00102240	8.573808330313458	81.46674246731098
SRR25665914.tsv	[('XBB* (XBB.X)', 0.9968959524086475)]	XBB.1.22.2 XBB.1.41 XBB.1.28.1 XBB.1.14 XBB.1.29 XBB.1.15 XBB.1.28 XBB.1.4 XBB.1.45 XBB.1.37 XBB.1.13	0.25242600 0.07444700 0.07444700 0.07444700 0.07444700 0.07444700 0.07444700 0.07444700 0.07444700 0.07444700 0.07444700	2.1588643067562456	44.65438250342775
