	summarized	lineages	abundances	resid	coverage
SRR25657392.tsv	[('XBB.1.9* [Omicron (XBB.1.9.X)]', 0.3831739550021788), ('XBB.1.16* [Omicron (XBB.1.16.X)]', 0.3617510000212066), ('XBB* (XBB.X)', 0.253211547929664), ('XBB.1.5* [Omicron (XBB.1.5.X)]', 0.0013302500400682775), ('Other', 0.00027470537170732375), ('CH.1.1* [Omicron (CH.1.1.X)]', 9.765159420818536e-05), ('XBB.2.3* [Omicron (XBB.2.3.X)]', 9.327406031491538e-05), ('Omicron', 6.12061532070995e-05)]	EG.5.1 XBB.1.16.12 XBB.1.22 XBB.1.16.11 XBB.1.42 XBB.1.16.8 XBB.1.16.10 EG.5.1.6 FY.6 XBB.1.25 FL.27 XBB.1.3 HP.1 HQ.1 XBB.1.44.1 XBB.1.16.13 XBB.1.16.9 FL.2.3.1 HE.1 FL.10 FL.8 GY.7 FL.20.1 FU.4 FL.5 XBB.1.5.50 FL.15 FL.23 XBB.1.43.1 XBB.1.42.2 FL.23.1 GN.1 FL.4.2 GU.1 FL.1.6 XBB.1.16.5 FL.1.5 HK.2 FU.5 XBB.1.5.64 FL.1.2 FL.1 EG.6.1 XBB.1.16.16 XBB.8.1 M.2 HV.1 XBB.1.16.15 FL.18 XBB.1.5.58 BA.4.1.7 XBB.2.9 EG.4.4 DV.7.1 GK.1.1 FY.1.2 GW.2 XBB.2.3.9 HU.1 GJ.1.1 C.2.1 B.1.641 XBB.1.24 FK.1.2.2 GY.8 HZ.2 GF.1 XBB.1.19.2 XBB.1.5.54 FZ.1 B.1.177.34 AM.3 B.1.438.4 GW.5 FL.22 C.31 FL.4.6 HK.3 B.1.177.38 XBB.1.5.44	0.37955474 0.23913300 0.20186151 0.10731260 0.04881765 0.01270356 0.00135747 0.00081007 0.00057439 0.00051043 0.00039888 0.00033505 0.00029964 0.00024747 0.00023715 0.00022632 0.00022571 0.00021690 0.00021626 0.00020919 0.00020452 0.00019767 0.00017167 0.00017095 0.00016698 0.00015744 0.00015161 0.00013752 0.00013034 0.00012998 0.00012929 0.00012817 0.00012784 0.00012732 0.00012617 0.00012482 0.00011197 0.00010877 0.00010599 0.00009747 0.00009649 0.00009649 0.00009643 0.00008460 0.00008381 0.00007990 0.00007684 0.00006913 0.00006889 0.00006383 0.00006121 0.00006032 0.00005870 0.00005838 0.00005801 0.00005573 0.00005320 0.00005003 0.00004835 0.00004324 0.00004107 0.00004025 0.00003987 0.00003927 0.00003919 0.00003908 0.00003667 0.00003391 0.00003239 0.00003103 0.00002798 0.00002623 0.00002453 0.00002359 0.00002276 0.00002183 0.00001665 0.00001458 0.00001292 0.00001175	11.616238263840522	93.76651172123198
SRR25657535.tsv	[('XBB* (XBB.X)', 0.4196800400095215), ('XBB.2.3* [Omicron (XBB.2.3.X)]', 0.3455040002940321), ('XBB.1.5* [Omicron (XBB.1.5.X)]', 0.13999337154127015), ('XBB.1.16* [Omicron (XBB.1.16.X)]', 0.07400449750332859), ('XBB.1.9* [Omicron (XBB.1.9.X)]', 0.02024468510708368), ('Other', 0.00047120274298136935), ('Omicron', 8.012570431706625e-05)]	GJ.1.2 XBB.1.22 FW.1 HZ.1 XBB.1.16.3 FY.5 FL.1.4 FZ.2 XBB.1.5.47 XBB.1.5.43 XBB.1.16.10 XBB.1.16.19 FL.2.3.1 EK.2.1 XBB.1.44.1 HQ.1 XBB.1.16.15 FP.2.1.2 XBB.1.9.7 HP.1.1 XBB.1.16.8 XBB.1.5.50 FL.27 XBB.1.16.13 XBB.1.5.1 HF.1 XBB.1.5.45 XBB.1.16.2 HS.1 XBB.1.12 FL.10 FL.19.1 XBB.1.16.20 XBB.1.45.1 XBB.1.16.16 FE.1.2 FL.17 XBB.1.5.81 XCD EK.3 FL.5.1 HA.2 FL.23 XBB.1.5.64 GU.1 FU.4 FL.2.2.1 XBB.1.5.44 GB.2 FL.4.2 XBB.1.15.1 XBB.1.5.34 GY.3 XBB.1.5.57 GJ.1.2.1 FL.24 FL.26.1 EG.9.1 FL.9 JB.2 FL.23.1 XBB.1.22.3 XBB.1.5.73 FP.1 GY.7 FL.11 FL.14 EU.1.1.1 FL.1.5.1 FL.18 FU.5 FG.1 EG.10.1 FL.3.1 GC.1 FY.4.1.1 XAW XBB.6.1 FT.2 FL.29 B.1.641 XBB.1.22.2 FY.2.1 XBB.1.16.7 XBB.1.27 FL.8 EG.5.2.3 XBB.1.9.6 XBB.1.34 FL.26 GA.3 XBB.1.5.58 XBB.1.5.85 XBB.1.37.1 XBB.1.16.14 XBB.1.19.2 FL.4.6 XCG FY.1.1 HW.1 HG.1 FL.28 XBB.1.16.6 XBB.1.9.5 XBB.1.16.4 FY.1 GB.1 HK.2 EG.4.4 XBB.8.1 GY.8 BA.2.9.1 XBB.1.16.5 GW.5 FZ.1 GJ.1.1 XBL.3.1 XBB.1.26 XBB.1.16.12 FL.22 HU.2 GY.6 XBB.1.24.2 GA.5 EU.1 B.1.127 BF.5.3 XBB.1.32 FT.3.1 XBB.1.32.1 FW.3 EG.4.1 BA.4.1.7 HU.1 EK.1 GK.1.1 HY.1 B.1.575.2 GD.2 FL.13.2 FY.3.1 XBB.1.13.1	0.34531668 0.19781049 0.16440110 0.11386100 0.06999256 0.05511103 0.01673936 0.00854086 0.00854086 0.00532900 0.00109752 0.00065317 0.00037478 0.00034388 0.00030948 0.00030829 0.00030086 0.00028927 0.00028903 0.00027655 0.00025819 0.00024316 0.00023730 0.00023209 0.00023084 0.00021654 0.00020642 0.00019062 0.00018950 0.00018548 0.00017982 0.00017749 0.00016932 0.00016707 0.00016535 0.00016279 0.00016061 0.00015922 0.00015907 0.00015116 0.00014929 0.00014625 0.00013642 0.00012865 0.00012702 0.00012542 0.00012140 0.00011568 0.00011502 0.00011446 0.00011168 0.00011074 0.00011049 0.00010961 0.00010783 0.00010527 0.00010166 0.00010037 0.00009427 0.00009422 0.00009187 0.00009145 0.00008892 0.00008713 0.00008607 0.00008063 0.00007812 0.00007696 0.00007673 0.00007620 0.00007536 0.00007500 0.00007489 0.00007472 0.00007338 0.00007290 0.00007137 0.00007107 0.00007080 0.00006908 0.00006875 0.00006791 0.00006721 0.00006633 0.00006604 0.00006499 0.00006428 0.00006341 0.00006185 0.00005809 0.00005754 0.00005634 0.00005316 0.00005152 0.00005148 0.00005066 0.00005065 0.00005055 0.00005016 0.00004766 0.00004707 0.00004314 0.00004199 0.00004074 0.00004014 0.00004008 0.00003848 0.00003805 0.00003711 0.00003637 0.00003623 0.00003445 0.00003409 0.00003273 0.00003273 0.00003242 0.00003237 0.00003155 0.00003077 0.00003060 0.00003006 0.00002990 0.00002767 0.00002589 0.00002548 0.00002540 0.00002504 0.00002400 0.00002230 0.00002226 0.00002122 0.00002071 0.00002064 0.00001864 0.00001787 0.00001764 0.00001639 0.00001604 0.00001492 0.00001421 0.00001304 0.00001271	11.07122338422422	93.63943417048456
SRR25657395.tsv	[('XBB.1.9* [Omicron (XBB.1.9.X)]', 0.9993605972820143), ('XBB.1.5* [Omicron (XBB.1.5.X)]', 0.00015981239859820748), ('XBB* (XBB.X)', 0.0001537438971516671), ('Other', 0.00013956196836500986), ('XBB.1.16* [Omicron (XBB.1.16.X)]', 0.00011616399521271292), ('Delta', 3.529788064836462e-05), ('A', 2.94047940227563e-05)]	HK.4 EG.5.1.1 EG.1.2 EG.5 XBB.1.16.15 FL.23.1 HR.1 FY.4.1.1 EG.5.2.1 EG.4.4 XBB.1.34.1 EG.6.1 HU.1 AY.46.6.1 B.1.36.33 B.1.438.4 A.30 GU.1 B.1.243.2 FL.3.4 HZ.2 B.1.22.1 B.1.1.425 GN.2 B.1.214.3 EG.11 EG.5.2.3	0.49932852 0.49932852 0.00021785 0.00015224 0.00011616 0.00010957 0.00009683 0.00006231 0.00006151 0.00006111 0.00005483 0.00005190 0.00003661 0.00003530 0.00003425 0.00002984 0.00002940 0.00002811 0.00002536 0.00002388 0.00001868 0.00001835 0.00001687 0.00001619 0.00001490 0.00001405 0.00001145	5.397397104743143	77.1193525733204
SRR25657380.tsv	[('XBB.1.16* [Omicron (XBB.1.16.X)]', 0.3986238658333587), ('XBB.1.9* [Omicron (XBB.1.9.X)]', 0.28791999998280493), ('CH.1.1* [Omicron (CH.1.1.X)]', 0.1996779999833045), ('XBB* (XBB.X)', 0.10279855226940121), ('Omicron', 0.010012266924508665), ('Other', 0.0004236843397041501), ('XBB.1.5* [Omicron (XBB.1.5.X)]', 0.00038234679341671025), ('XBB.2.3* [Omicron (XBB.2.3.X)]', 0.00015523500881101907)]	CH.1.1.1 XBB.1.16 XBB.1.16.18 XBB.1.16.20 EG.5 EG.6.1 XBB.1.38 XBB.1.38.1 XBB.1.9.1 EG.2 BY.1 XBB.1.16.15 XBB.1.16.19 XBB.1.9.5 FL.1.4 XBB.1.25 XBB.1.16.10 XBB.1.16.13 FL.26 FP.3 FL.3.1 XBB.1.22.2 FL.10 FL.20 XBB.1.12 XBB.1.15 BY.1.2 FL.19.1 GY.8 CA.6 FL.2.3 FL.1.5.1 FE.1.2 FL.23 XBB.1.16.9 BY.1.1.1 XBB.1.16.8 XBB.1.27 XBD XBB.1.31 XBB.1.16.16 XBY FL.23.1 CH.1.1.4 FP.2.1.2 XBB.1.3 CA.2 FL.15 XBH GY.1 FL.7 HU.2 EG.4.1 GJ.2 XBB.1.16.7 FU.4 FY.4.1.1 CA.3.1 EG.9 HR.1 HK.4 EG.5.1.1 FK.1.4 B.1.499.1 EU.1.1.1 CH.1.1.7 FL.4.1.1 BL.1.1 EG.9.1 FL.10.1 BN.1.1.1 XBB.1.7 FL.26.1 DV.2 FL.9 XBB.1.16.1 B.1.498 FL.5 XBB.1.9.4 GF.1 CH.1.1.17 FL.17 XBB.1.26 HP.1.1 XBB.1.18 BA.2.75.9 B.1.1.327 GN.3 CH.1.1.26 FL.22 CM.8.1.5 BM.6 FY.2.1 BL.1.2 XBB.2.3.5 B.1.36.33 BG.4 FK.1.2.2 BL.1.4	0.19908699 0.17325387 0.10704807 0.10704807 0.10648647 0.08948440 0.04933669 0.04933669 0.04901541 0.03613617 0.00812756 0.00525014 0.00297177 0.00089993 0.00087012 0.00086133 0.00085832 0.00077746 0.00077495 0.00060181 0.00059300 0.00049771 0.00042176 0.00036914 0.00036132 0.00035984 0.00034867 0.00034638 0.00033990 0.00033646 0.00033346 0.00033025 0.00026669 0.00024364 0.00023004 0.00020812 0.00020719 0.00019612 0.00019512 0.00018975 0.00017834 0.00016073 0.00015773 0.00015699 0.00015500 0.00014671 0.00014299 0.00014150 0.00014011 0.00013782 0.00013780 0.00013261 0.00012663 0.00012468 0.00012243 0.00012070 0.00011903 0.00011883 0.00011845 0.00011091 0.00010847 0.00010847 0.00010815 0.00010571 0.00010369 0.00010333 0.00010084 0.00009899 0.00009894 0.00009397 0.00009335 0.00009263 0.00009235 0.00008946 0.00008912 0.00007974 0.00007780 0.00007748 0.00006769 0.00006138 0.00006124 0.00005854 0.00005758 0.00005717 0.00005545 0.00005509 0.00004991 0.00004920 0.00004659 0.00003693 0.00003441 0.00003374 0.00003159 0.00003123 0.00003055 0.00002953 0.00002600 0.00002524 0.00002161	12.937628289320017	82.78433601979735
SRR25657384.tsv	[('XBB* (XBB.X)', 0.39423170506556693), ('XBB.1.16* [Omicron (XBB.1.16.X)]', 0.32330499999177814), ('XBB.1.9* [Omicron (XBB.1.9.X)]', 0.28081240628790916), ('XBB.1.5* [Omicron (XBB.1.5.X)]', 0.0012874579924878938), ('Other', 0.0002526642536768426), ('XBB.2.3* [Omicron (XBB.2.3.X)]', 6.149038126886097e-05), ('Omicron', 2.2745700739769348e-05)]	EG.2 XBB.1.42.1 XBB.1.16.15 XBB.1.42.2 XBB.1.16.1 FU.4 XBB.1.16.8 HR.1 XBB.1.16.13 XBB.1.5.57 FU.1 EG.6 HA.2 XBB.1.44.1 FL.2.3.1 XBB.1.5.45 FL.4.6 EG.1.8 FU.5 EK.2.1 FL.23.1 EG.9 FL.9 FY.4.1.1 FU.2.1 HN.1 FL.18.1.1 FL.13.1 GK.1.1 XBB.2.9 FL.28 FL.24 XBB.1.16.7 XBB.6.1 HU.2 FY.1.2 EG.2.1 FL.19.1 GY.1 FL.14 FP.1 XBB.1.34 EG.5.2.1 FP.2.1.2 EK.1 EG.9.1 EG.4.2 EG.5.2.2 XBB.1.19.2 XBB.1.15.1 AV.1 XBB.1.12.1 XAW B.1.177.34 XCD XBB.1.5.43 EU.1.1.1 GS.1 B.1.641 EG.4.1 FL.20 XBB.2.3.9 XBB.1.32 EG.10.1 FP.2.1.1 GN.2 B.1.438.4 BA.2.86 B.1.243.2 EG.5.1.1 HK.4 XBB.8.1 EU.1 HQ.1 EU.1.1 EU.1.1.2 B.1.1.345	0.27896049 0.23714505 0.18872100 0.15613156 0.13317451 0.00029244 0.00029229 0.00026848 0.00025707 0.00024275 0.00022217 0.00021973 0.00021599 0.00019578 0.00016340 0.00014674 0.00011973 0.00011744 0.00011726 0.00011101 0.00009616 0.00009468 0.00009465 0.00009433 0.00009054 0.00008977 0.00008842 0.00008732 0.00008300 0.00008213 0.00008049 0.00007908 0.00007705 0.00007155 0.00006816 0.00006657 0.00006387 0.00006354 0.00006067 0.00005822 0.00005765 0.00005756 0.00005722 0.00005025 0.00004955 0.00004901 0.00004895 0.00004871 0.00004797 0.00004753 0.00004287 0.00004186 0.00004113 0.00004112 0.00003418 0.00003335 0.00003283 0.00003220 0.00003161 0.00003120 0.00003052 0.00002929 0.00002693 0.00002581 0.00002549 0.00002459 0.00002397 0.00002275 0.00002230 0.00002199 0.00002199 0.00002134 0.00002028 0.00001981 0.00001954 0.00001954 0.00001548	9.586277615435357	85.00150486573254
SRR25665979.tsv	[('XBB.1.5* [Omicron (XBB.1.5.X)]', 0.5316133826049664), ('XBB.1.9* [Omicron (XBB.1.9.X)]', 0.44847207271566064), ('XBB* (XBB.X)', 0.01629778641492345)]	XBB.1.5.52 EG.2 EG.5 FL.22 FL.2 FL.26 XBB.1.9.1 XBB.1.42.1 FP.3	0.53161338 0.16164987 0.16028399 0.03163455 0.03163455 0.03163455 0.03163455 0.01514795 0.00114984	9.738327848619306	65.82617128716183
SRR25665852.tsv	[('XBB.1.16* [Omicron (XBB.1.16.X)]', 0.7997578586731984), ('XBB.1.9* [Omicron (XBB.1.9.X)]', 0.19997999949291337)]	HN.1 FU.2.1 XBB.1.16.4 XBB.1.16.22 XBB.1.16.20 XBB.1.16.21 XBB.1.16.10 XBB.1.16.17 XBB.1.16.1 XBB.1.16.11 XBB.1.16.6 XBB.1.16.12 XBB.1.16.14 XBB.1.16.7 XBB.1.16.9 XBB.1.16.8 XBB.1.16.16 FU.1 FU.2 FU.3 XBB.1.16.13 FU.4 XBB.1.16	0.19998000 0.03635263 0.03635263 0.03635263 0.03635263 0.03635263 0.03635263 0.03635263 0.03635263 0.03635263 0.03635263 0.03635263 0.03635263 0.03635263 0.03635263 0.03635263 0.03635263 0.03635263 0.03635263 0.03635263 0.03635263 0.03635263 0.03635263	1.1820832790541151	17.035080092298433
SRR25645468.tsv	[('XBB.1.5* [Omicron (XBB.1.5.X)]', 0.39488252480900765), ('XBB* (XBB.X)', 0.39014958397084953), ('XBB.1.16* [Omicron (XBB.1.16.X)]', 0.1526293414550698), ('XBB.1.9* [Omicron (XBB.1.9.X)]', 0.012954216319422812)]	XBB.1.22.2 XBB.1.22 XBB.1.16.12 HP.1 XBB.1.5.59 XBB.1.5 XBB.1.5.23 EG.5.1 FL.29 XBB.1.5.38 FU.5 FL.22 FL.19.1 FE.1.2 GC.1 XBB.1.5.99 EG.5.1.4 XBB.1.5.87 XBB.1.5.82 FL.6 HU.2 HP.1.1 XBB.1.5.27 FL.2.3.1 FU.4 XBB.1.5.10 XBB.1.5.80 XBB.1.5.29 FU.1 FY.4.1 XBB.1.45.1 XBB.2.9	0.21781843 0.16580417 0.14823905 0.14653514 0.09156222 0.07093341 0.07093341 0.00279163 0.00201920 0.00198570 0.00198125 0.00192864 0.00181214 0.00180390 0.00179268 0.00171902 0.00164533 0.00160665 0.00158397 0.00146958 0.00136388 0.00131134 0.00129069 0.00128770 0.00124591 0.00121473 0.00120846 0.00120511 0.00116313 0.00113838 0.00111159 0.00110923	13.495396026366729	87.25545931846302
SRR25657446.tsv	[('XBB.1.9* [Omicron (XBB.1.9.X)]', 0.9952632294678061), ('XBB.1.5* [Omicron (XBB.1.5.X)]', 0.00234284430221673), ('XBB.1.16* [Omicron (XBB.1.16.X)]', 0.0012019200122453783), ('XBB* (XBB.X)', 0.0007702213461042657), ('Other', 0.00018134718001491828), ('Omicron', 9.193513809102576e-05), ('XBB.2.3* [Omicron (XBB.2.3.X)]', 6.529400085710406e-05), ('A', 4.171050149847379e-05), ('CH.1.1* [Omicron (CH.1.1.X)]', 1.3316190547670833e-05)]	HN.1 EG.2 EG.5.1.4 FL.1.5.1 HV.1 EG.5.1.3 FU.1 HS.1 XBB.1.5.89 XBB.1.44.1 XBB.1.9.7 FL.3.1 HR.1 EG.5.1.2 HK.3 GK.1.1 XBB.1.16.8 GK.1.2 GN.1.1 EG.9.1 XBB.1.42.1 FL.4.1.1 FL.5.1 FL.20 GK.3.1 EU.1.1.1 XBB.1.5.50 HY.1 GB.2 HP.1.1 HQ.1 HB.1 FL.9 GJ.1.1 XBB.1.5.81 HJ.1 XBB.1.47.1 FR.1.3 FL.24 XBB.1.5.44 FP.2.1.2 FL.23.1 FL.22 GY.8 FL.21.1 FY.1.2 FL.4.7 FU.3.1 N.10 A.30 XBB.1.5.85 HU.2 FY.7 EG.4.4 FU.5 EG.6.1 GK.2 B.1.641 HU.1 XBB.1.22.3 B.1.36.33 XBB.1.5.64 AV.1 FL.3.4 XH XBB.1.27 FL.2.2 FT.3.1.1 FL.28 XAY.1.1.3 HZ.1 DV.7.1 C.1.2 B.1.438.4 BP.1	0.83599600 0.08474102 0.05111825 0.01254575 0.00826281 0.00099055 0.00092768 0.00054050 0.00028602 0.00026208 0.00020190 0.00018771 0.00017966 0.00017289 0.00016208 0.00014599 0.00014409 0.00013448 0.00012888 0.00012032 0.00010887 0.00010407 0.00010246 0.00009075 0.00009050 0.00009011 0.00008962 0.00008743 0.00008611 0.00008330 0.00008232 0.00007836 0.00007547 0.00006529 0.00006153 0.00005757 0.00005588 0.00005556 0.00005302 0.00005194 0.00005054 0.00005011 0.00004984 0.00004866 0.00004706 0.00004650 0.00004442 0.00004354 0.00004291 0.00004171 0.00004162 0.00003928 0.00003891 0.00003824 0.00003794 0.00003608 0.00003472 0.00003423 0.00003327 0.00003154 0.00003082 0.00002949 0.00002876 0.00002734 0.00002588 0.00002499 0.00002384 0.00002320 0.00002125 0.00002051 0.00001785 0.00001332 0.00001251 0.00001160 0.00001049	7.51868066557323	96.55887369160286
SRR25665867.tsv	[('XBB.1.9* [Omicron (XBB.1.9.X)]', 0.9649625349996693), ('Omicron', 0.030750532998934207), ('XBB.1.16* [Omicron (XBB.1.16.X)]', 0.0019841299999929503)]	EG.5 EG.5.1 EG.5.1.1 BA.2.66 XBB.1.16.10 DF.1 BA.5.10.1	0.32165418 0.32165418 0.32165418 0.02761081 0.00198413 0.00156986 0.00156986	0.6420130368153492	7.597899876266595
SRR25645471.tsv	[('XBB* (XBB.X)', 0.5315764280108258), ('XBB.1.16* [Omicron (XBB.1.16.X)]', 0.3422691597314288), ('XBB.1.5* [Omicron (XBB.1.5.X)]', 0.05582642763512446), ('XBB.1.9* [Omicron (XBB.1.9.X)]', 0.024203945713839537), ('Other', 0.0024041636337892194)]	FY.5 XBB.1.16.12 XBB.1.16 XBB.1.16.9 XBB.1.5.28 EG.2 XBB.1.5.40 FL.9 XBB.1.16.10 FE.1.2 XCF XBB.1.9.7 XBB.1.16.7 FL.4.1.1 FL.1.5.1 HS.1 XBB.2.9 FL.6 FT.1 XBB.1.16.21 FL.2.2 FU.5 XBB.1.16.4 GG.1 EG.5.1.2 FL.29	0.52717622 0.14800939 0.11460300 0.07081571 0.04297949 0.00851763 0.00830722 0.00372169 0.00254132 0.00247962 0.00240416 0.00240083 0.00220751 0.00208159 0.00207862 0.00192102 0.00192059 0.00182408 0.00156250 0.00155376 0.00149492 0.00147562 0.00106285 0.00105619 0.00104515 0.00103943	13.902637837523333	96.86319098418218
SRR25657366.tsv	[('XBB.1.16* [Omicron (XBB.1.16.X)]', 0.9543024660759889), ('XBB.1.9* [Omicron (XBB.1.9.X)]', 0.025321623069977383), ('XBB.1.5* [Omicron (XBB.1.5.X)]', 0.010149320163691872)]	XBB.1.16.6 EG.2 XBB.1.5.28 HK.3 EG.5.1.4 XBB.1.16.1 XBB.1.5.49 EG.5.1.1	0.95135572 0.01552457 0.00724345 0.00466991 0.00333579 0.00294675 0.00290587 0.00179135	6.979666471459796	98.54195231247701
SRR25657523.tsv	[('XBB.1.9* [Omicron (XBB.1.9.X)]', 0.9955422582572009), ('XBB* (XBB.X)', 0.0018734939943573705), ('XBB.1.5* [Omicron (XBB.1.5.X)]', 0.001816283595168324), ('XBB.1.16* [Omicron (XBB.1.16.X)]', 0.00032120499979662294), ('Other', 0.00021215215554584726), ('XBB.2.3* [Omicron (XBB.2.3.X)]', 0.0001507190008907608), ('Omicron', 4.093505913941963e-05), ('Delta', 3.1761200084311874e-05)]	EG.5.1.2 EG.5.1 EG.5.1.1 HK.4 HK.5 XBB.1.25 XBB.1.9.3 EG.5.1.4 EK.2 EG.5.1.5 HF.1 HQ.1 FL.2.3.1 EG.5.1.6 FL.3.1 FL.23.1 HR.1 HA.1 FL.23 XBB.1.5.50 FL.17.1 XBB.1.44.1 FL.29 XBB.1.5.94 FL.19.1 XBB.1.5.73 HK.2 FY.4.1.1 FY.2.1 XBB.1.37.1 XBB.1.5.26 FL.4.2 EG.10.1 GW.2 FL.5 XBB.1.26 GD.1 XBB.1.22.2 FL.8 XBB.2.3.12 FL.1.3 XBB.1.5.74 XBB.1.5.64 FL.24 FL.22 XBB.2.9 XCD FL.1.5 FL.18.1 EU.1.1.1 EG.4.1 FL.12 GJ.1.1 EG.5.2.2 BA.5.1.38 EG.5.2.1 B.1.640.2 B.1.438.4 AY.124.1.1 XD XBB.1.22.3 FL.1 FL.1.2 XAW FW.3 XBB.2.3.6 B.1.622 XBL.3.1 FL.4.7	0.28459496 0.28459496 0.14059036 0.14059036 0.14059036 0.00091324 0.00075247 0.00059065 0.00035199 0.00034682 0.00032120 0.00032086 0.00029472 0.00025556 0.00025536 0.00022160 0.00019713 0.00018208 0.00017836 0.00015185 0.00014901 0.00014637 0.00013795 0.00013534 0.00013428 0.00013383 0.00012393 0.00012283 0.00012189 0.00012096 0.00011859 0.00011771 0.00011715 0.00011511 0.00011323 0.00010465 0.00010273 0.00010271 0.00009348 0.00009176 0.00009105 0.00009039 0.00008362 0.00008155 0.00007598 0.00007335 0.00006578 0.00005133 0.00005132 0.00005059 0.00004846 0.00004831 0.00004602 0.00004407 0.00004094 0.00003545 0.00003477 0.00003472 0.00003176 0.00002989 0.00002953 0.00002905 0.00002905 0.00002371 0.00002287 0.00001294 0.00001234 0.00001094 0.00001063	10.562952717312939	60.445440256830416
SRR25657435.tsv	[('XBB.1.16* [Omicron (XBB.1.16.X)]', 0.397048998194175), ('XBB* (XBB.X)', 0.3856129317741649), ('XBB.1.9* [Omicron (XBB.1.9.X)]', 0.20930200114892464), ('XBB.2.3* [Omicron (XBB.2.3.X)]', 0.006248859831889557), ('XBB.1.5* [Omicron (XBB.1.5.X)]', 0.0013503245197823172), ('Other', 0.00029623009338110946), ('A', 4.081604360075466e-05), ('Omicron', 2.995748246602414e-05), ('Mu', 2.3232833365078955e-05), ('Alpha', 1.587405599952548e-05)]	XBB.1.16.1 XBB.1.42.1 FY.5 XBB.1.9.7 XBB.1.16.3 EG.2 XBB.1.16.12 XBB.2.3.11 XBB.1.16.10 FL.1.5.1 FU.2 XBB.2.3.8 EG.4.2 HR.1 FU.4 XBB.1.5.89 HF.1 FP.2.1 FY.2.1 FU.5 XBB.1.16.8 HU.2 XBB.1.16.16 XCD XBB.1.16.14 XBB.1.16.5 FE.1.2 FL.5.1 GE.1 HH.1.1 GN.1.1 GY.8 FL.4.1.1 EG.4.4 FW.3 HK.2 JB.2 GU.1 XBB.1.5.27 FL.1.7 FT.3.1.1 EG.1.3 XBB.1.45.1 EG.9 EG.4.3 XBB.1.31.1 GW.1 FL.28 XAW EG.6.1 FY.4.1.1 GK.1.1 A.30 XBB.1.5.58 XBB.1.5.87 FL.3.4 EG.4.1 XBB.8.1 XBB.6.1 XBB.1.16.7 XBB.1.5.85 HL.2 HP.1.1 GB.2 B.1.626 B.1.621.2 B.1.438.4 XBB.1.5.90 GM.1 BA.2.9.7 B.1.575.1 B.1.641 FL.23.1 Q.5 BA.2.86	0.31603319 0.22839385 0.15600512 0.15398136 0.06870744 0.05320413 0.00892429 0.00545550 0.00105574 0.00073257 0.00064704 0.00052848 0.00050774 0.00045687 0.00038946 0.00027094 0.00026783 0.00024450 0.00023935 0.00020131 0.00018619 0.00017375 0.00017187 0.00016940 0.00016670 0.00014902 0.00014642 0.00012934 0.00012388 0.00012130 0.00011989 0.00011332 0.00010903 0.00010677 0.00010281 0.00009916 0.00007409 0.00006989 0.00006901 0.00006871 0.00006746 0.00006164 0.00006072 0.00005861 0.00005629 0.00005331 0.00004773 0.00004620 0.00004594 0.00004483 0.00004348 0.00004114 0.00004082 0.00004074 0.00004063 0.00003940 0.00003934 0.00003811 0.00003601 0.00003559 0.00002862 0.00002777 0.00002623 0.00002486 0.00002478 0.00002323 0.00002183 0.00001995 0.00001971 0.00001774 0.00001740 0.00001688 0.00001687 0.00001587 0.00001222	9.910434666318427	79.81473430759456
SRR25666034.tsv	[('XBB.1.16* [Omicron (XBB.1.16.X)]', 0.9985969897087118)]	XBB.1.16 GY.2.1 GY.8 GY.5 GY.2 XBB.1.16.13 XBB.1.16.2 FU.2 XBB.1.16.9 XBB.1.16.7 XBB.1.16.4 XBB.1.16.11 XBB.1.16.1 XBB.1.16.3 XBB.1.16.17	0.14663722 0.06085427 0.06085427 0.06085427 0.06085427 0.06085427 0.06085427 0.06085427 0.06085427 0.06085427 0.06085427 0.06085427 0.06085427 0.06085427 0.06085427	7.114626204012969	42.0158512523827
SRR25657487.tsv	[('XBB.1.5* [Omicron (XBB.1.5.X)]', 0.7727082402510365), ('XBB.1.16* [Omicron (XBB.1.16.X)]', 0.22222199919583932)]	FD.1 XBB.1.16 FT.3.1.1 GV.1 FT.3.1 GG.1 XBB.1.5.81 HY.1 HS.1 XBB.1.5.28	0.50000000 0.22222200 0.03408853 0.03408853 0.03408853 0.03408853 0.03408853 0.03408853 0.03408853 0.03408853	2.1652322570444227	14.316289335518176
SRR25657484.tsv	[('XBB.1.9* [Omicron (XBB.1.9.X)]', 0.5718752115667474), ('XBB.1.5* [Omicron (XBB.1.5.X)]', 0.4172795551285372)]	HA.1 FL.2.2 FL.17.2 EG.2 XBB.1.9.7 HP.1.1 FL.1.4	0.41615185 0.36448756 0.09679753 0.09428933 0.01526638 0.00112771 0.00103442	5.357275806948823	47.3631408219911
SRR25665952.tsv	[('XBB.1.5* [Omicron (XBB.1.5.X)]', 0.9997917100021112), ('Omicron', 0.00020829000435245047)]	HZ.1 BF.7.19.1	0.99979171 0.00020829	0.6579838343663823	3.9761896799652208
SRR25657369.tsv	[('XBB.1.9* [Omicron (XBB.1.9.X)]', 0.39404606850294466), ('XBB.1.16* [Omicron (XBB.1.16.X)]', 0.25098631381535524), ('XBB.1.5* [Omicron (XBB.1.5.X)]', 0.20516774272730354), ('XBB.2.3* [Omicron (XBB.2.3.X)]', 0.11975397551388962), ('XBB* (XBB.X)', 0.01279302726963617)]	EG.5.1.1 EG.5.1.4 XBB.1.16.2 GJ.1.2 XBB.1.5.20 XBB.1.16.12 XBB.1.5.28 XBB.1.5.73 XBB.1.16.13 XBB.1.16.19 GE.1 HV.1 EG.4 XBB.1.5.70 FL.1.5.1 FL.7 XBB.1.38 FL.21 HN.1 XBB.1.16.16 XBB.2.3.11 FU.2.1 XBB.1.16.10	0.15357554 0.12069659 0.08629389 0.07138117 0.06873612 0.05827259 0.05525509 0.05209452 0.04956168 0.04914150 0.04706750 0.03358067 0.02947110 0.02908202 0.02721388 0.01404722 0.01279303 0.00903361 0.00642745 0.00549966 0.00130531 0.00117302 0.00104397	12.189970715542865	98.54195231247701
SRR25657454.tsv	[('XBB.1.9* [Omicron (XBB.1.9.X)]', 0.6941139999933177), ('XBB.1.5* [Omicron (XBB.1.5.X)]', 0.30052683519421913), ('XBB* (XBB.X)', 0.004056944982322582), ('Other', 0.0006741495124971199), ('Omicron', 0.0004692400063134049), ('XBB.2.3* [Omicron (XBB.2.3.X)]', 0.0001192529992431716), ('XBB.1.16* [Omicron (XBB.1.16.X)]', 3.957729923478769e-05)]	XBB.1.9.2 XBB.1.5.59 XBB.1.9 XBB.1.5.30 XBB.1.23 XBB.1.5.51 XBB.1.5.95 XBB.1.24 XBB.1.5.41 XBB.1.5.67 FY.2.1 XBB.1.5.55 EG.7 XBB.1.5.50 XCG EG.5.1.5 FY.6 GV.1 XBB.1.5.101 FL.12 EG.5.1.3 FL.1 FL.1.1 FL.1.2 XBB.1.5.83 FL.10 XBB.1.5.49 XBB.3.5 XBB.1.5.82 EG.6 XBB.1.5.7 XBB.1.5.46 FL.1.5 XBB.3.1 EG.5.1.6 FY.4.1.1 XBB.1.9.6 XBB.1.5.25 XBB.1.5.19 CV.2 XBB.1.42.2 HN.1 HP.1 XBB.1.3 FL.5.1 BA.4.1.8 XBB.1.22.3 HR.1 XBB.2.3.6 FY.1.2 XBB.1.44.1 XBB.1.5.1 HJ.1 XBB.1.5.54 HL.2 XBB.1.5.81 XBB.1.5.47 FZ.2 XBB.2.9 XBB.1.5.9 B.1.1.338 FL.9 BQ.1.10.3 FL.4.6 FL.24 XBN FL.22 EG.5.1 XBB.8.1 HK.3 AD.2 XBB.1.5.53 JB.1 EG.5.2.2 HU.2 EG.6.1 XBB.1.5.64 BA.3 EG.4.1 XBW FH.1 FL.4.2 XBB.1.16.8 BA.5.1.38 XBB.1.5.43 BF.7.5 XBB.1.9.3 B.1.1.506 XBB.1.5.85 XBB.1.9.4 GK.1.1	0.67216278 0.29157313 0.01792777 0.00196464 0.00120976 0.00113228 0.00077292 0.00057241 0.00055289 0.00054215 0.00047356 0.00046572 0.00039520 0.00039139 0.00037584 0.00035486 0.00032563 0.00032082 0.00031516 0.00031506 0.00030358 0.00027495 0.00027495 0.00027495 0.00023858 0.00023708 0.00022359 0.00022189 0.00018073 0.00015963 0.00015949 0.00015926 0.00015761 0.00015574 0.00015547 0.00015360 0.00015001 0.00014611 0.00014594 0.00014548 0.00014437 0.00013629 0.00013398 0.00013110 0.00012991 0.00012525 0.00012341 0.00012119 0.00011925 0.00011561 0.00010953 0.00010680 0.00010609 0.00010312 0.00009926 0.00009704 0.00009504 0.00009504 0.00009501 0.00009381 0.00008872 0.00008344 0.00008239 0.00007910 0.00007849 0.00007690 0.00007397 0.00006926 0.00006889 0.00006840 0.00006577 0.00006369 0.00006369 0.00005942 0.00005719 0.00005400 0.00005381 0.00005200 0.00004976 0.00004541 0.00004362 0.00004334 0.00003958 0.00003297 0.00003170 0.00003116 0.00002644 0.00002151 0.00001891 0.00001826 0.00001448	8.809541191950752	72.91241681436645
SRR25645472.tsv	[('XBB.1.5* [Omicron (XBB.1.5.X)]', 0.44075456463058243), ('XBB.1.16* [Omicron (XBB.1.16.X)]', 0.3884302109607353), ('XBB* (XBB.X)', 0.09810148340841505), ('XBB.1.9* [Omicron (XBB.1.9.X)]', 0.016374186754623793), ('Other', 0.004871617814401894)]	XBB.1.16.11 XBB.1.5.10 XBB.1.5.2 XBB.1.16.6 XBB.1.22 XBB.1.5.59 FY.5 XBB.1.42.1 FL.24 FE.1.1.2 XBB.1.16.16 FL.22 XBN HS.1 FL.6 FL.4.5 FU.5 HZ.2 FL.29 FL.3.2 FL.2.2 XCC XBB.1.37.1 XBL.2 XBB.1.5.80 FL.4.2	0.29801055 0.23533400 0.17653449 0.08544710 0.07888434 0.02380097 0.00774919 0.00711903 0.00386100 0.00319130 0.00309310 0.00239764 0.00222589 0.00213675 0.00213041 0.00188146 0.00187946 0.00187683 0.00187161 0.00160442 0.00157001 0.00152903 0.00115763 0.00111669 0.00107152 0.00105764	15.172997439530018	99.66224124669766
SRR25665938.tsv	[('XBB.1.9* [Omicron (XBB.1.9.X)]', 0.9999999986445905)]	EG.5.2.1	1.00000000	0.014836358032702838	3.487944353409357
SRR25657260.tsv	[('XBB.1.9* [Omicron (XBB.1.9.X)]', 0.4637307812588159), ('XBB.1.5* [Omicron (XBB.1.5.X)]', 0.27912920855979095), ('XBB.1.16* [Omicron (XBB.1.16.X)]', 0.2511597661245436), ('XBB* (XBB.X)', 0.005322413434896333), ('Other', 0.00042386392840757783), ('XBB.2.3* [Omicron (XBB.2.3.X)]', 0.00021852040001925962)]	EG.5.1 XBB.1.5.73 XBB.1.16.6 XBB.1.16 XBB.1.16.1 FP.3 XBB.1.9.7 FL.1.4 FP.2.1 FU.4 FP.1 XBB.1.44.1 FL.2.3.1 XBB.2.3.8 XBB.1.22.2 HV.1 XBB.1.27 FL.4.1.1 XBB.1.3 XCG XBB.1.46 FL.2.2 XBB.2.8 XBB.1.16.16 FL.18.1 EG.5.1.3 HN.1 FL.5.1 FL.9 XBB.1.16.8 FL.4.6 XBB.1.5.64 XBB.8.1 GN.4 B.4.7 HK.2 GN.3 HP.1.1 XBB.1.5.87 XBB.1.34 FL.12 XBB.1.32 B.1.1.393 EG.5.1.1 HZ.1 FW.3 XBB.1.42.1 XBB.1.5.85 FP.2.1.2 EG.4.1 FL.10 XBB.1.16.15 C.2.1 EG.5.2.3 XBB.1.7 FL.23.1 B.51 HQ.1 XBB.1.5.58 AJ.1 GU.1	0.46060042 0.27848781 0.17993100 0.04308777 0.02749783 0.00293376 0.00059988 0.00051292 0.00046298 0.00032730 0.00029918 0.00028715 0.00028070 0.00021852 0.00021622 0.00019847 0.00019539 0.00018479 0.00018353 0.00017696 0.00016951 0.00016002 0.00015489 0.00015172 0.00015134 0.00014786 0.00013855 0.00013532 0.00013271 0.00012195 0.00011476 0.00011318 0.00010653 0.00010308 0.00010085 0.00009470 0.00009188 0.00009093 0.00009079 0.00007300 0.00006388 0.00006184 0.00006114 0.00005283 0.00005105 0.00004885 0.00004861 0.00004805 0.00004800 0.00004551 0.00004392 0.00004219 0.00004126 0.00004072 0.00003298 0.00003148 0.00002505 0.00002270 0.00001905 0.00001861 0.00001070	12.5053972904288	89.81373106377286
